Tweet,Stance,Index,Original Tweet
"fox news report shows you is state department cannot locate 15 of hillary clinton 's private emails not so fast , hillary !",AGAINST,1900,"@FoxNews report shows U.S. State Department cannot locate 15 of Hillary Clinton's Private Emails.  Not so fast, Hillary! #SemST"
callisto 1947 texas man 2008 amy mek hillary 's new campaign slogan hillary nothing to hide except the truth ! ! ! # t cot # # c cot #,AGAINST,1901,@Callisto1947 @texasman2008 @AmyMek Hillary's new Campaign Slogan:  HILLARY - NOTHING TO HIDE EXCEPT THE TRUTH !!!  #TCOT #CCOT #SemST
i really need my new hillary clinton shirt to come in meeting some people at the brewery same night as a bernie meetup there,FAVOR,1902,I really need my new @HillaryClinton shirt to come in. Meeting some people at the brewery same night as a Bernie meetup there. #SemST
"donald trump is a joke his a simple minded idiot , and i have nothing else to say about him he can go fuck him self",NONE,1903,"Donald Trump is a joke. His a simpleminded idiot, and I have nothing else to say about him. He can go FUCK him self. #SemST"
hillary clinton ca hillary stand on the right side,FAVOR,1904,@HillaryClinton @ca_hillary stand on the right side #SemST
hillary clinton said # all lives matter # just like she said marriage was between a man and a woman ! giver her a few more years,AGAINST,1905,@HillaryClinton said #AllLivesMatter just like she said marriage was between a man and a woman! Giver her a few more years #SemST
# hillary debate question # so you profess admiration for # margaret sanger # who wanted to rid the country of negros explain please ?,AGAINST,1906,"#HillaryDebateQuestion So you profess admiration for #MargaretSanger who wanted to rid the country of ""negros"". Explain please? #SemST"
rt mci re lli 92 hillary for the win,FAVOR,1907,RT @mcirelli92: Hillary for the win #SemST
why did # rand paul # take donations from a # white supremacy # group after shaking hands with black leaders ? # black lives matter # # gop #,NONE,1908,Y did #randpaul take donations from a #WhiteSupremacy group after shaking hands with black leaders? #BlackLivesMatter #gop #SemST
claire cm c rosie gray is that why she and clinton global take that # saudi # money ? # saudi cables # # saudi cables # # clinton 2016 #,AGAINST,1909,@clairecmc @RosieGray is that why she and @ClintonGlobal take that #Saudi money? #SaudiCables #SaudiCables #clinton2016 #SemST
pete fr t this is how gop needs to be handling campaign not attacking each other but showing all hillary fails # unite right #,AGAINST,1910,@petefrt this is how GOP needs to be handling campaign not attacking each other but showing all hillary fails. #uniteright #SemST
molls 30 hillary clinton i love it ! one of our biggest donors is saudi arabia they support women 's rights completely ! # go team #,AGAINST,1911,@Molls30 @HillaryClinton I love it! One of our biggest donors is Saudi Arabia. They support women's rights completely! #GoTeam #SemST
hillary clinton did you feel same about # bill clinton # 's latest assault of teen girl ? # hypocrite # # hillary clinton # # hillary # 2016 no,AGAINST,1912,@HillaryClinton Did you feel same about #BillClinton's latest assault of teen girl? #hypocrite #HillaryClinton #Hillary_2016_NO #SemST
my vote is definitely for hillary i do n't want bush 's dumb ass do n't want trump either # hillary clinton #,FAVOR,1913,My vote is definitely for Hillary. I don't want Bush's dumb ass. Don't want Trump either.  #HillaryClinton #SemST
"i'm in a better place now that i got some coffee , now time to grow these grassroots # sc tweets #",NONE,1914,"I'm in a better place now that I got some coffee, now time to grow these grassroots   #sctweets #SemST"
"scotus scalia right words no longer have meaning like clinton , it depends on what the meaning of ' is ' is more if we do n't",AGAINST,1915,"@SCOTUS_Scalia Right. Words no longer have meaning. Like Clintons,""It depends on what the meaning of 'is' is."" More if we don't #SemST"
ted cruz wo n't be there i'm supporting hillary clinton for president # lgbt rights # # aca works #,FAVOR,1916,@tedcruz won't be there. I'm supporting @HillaryClinton for President. #lgbtrights #ACAWorks #SemST
"gideon henry first scotus reaffirms obamacare , then it legalize gay marriage your world is crumbling !",NONE,1917,"@GideonHenry First SCOTUS reaffirms Obamacare, then it legalize gay marriage. Your world is crumbling! #SemST"
what a huge win for america ! today is absolutely historic # equality wins # # scotus marriage #,NONE,1918,What a huge win for America! Today is absolutely historic. #EqualityWins #SCOTUSMarriage #SemST
my sexy daddy obama had two wins this week happy for him democrats,NONE,1919,My sexy daddy Obama had two wins this week. Happy for him & democrats   #SemST
today show hillary 's emails missing and incomplete ? who 'd of thunk it ? ? just trust me ! ! !,AGAINST,1920,@TODAYshow Hillary's emails missing and incomplete? Who'd of thunk it??  JUST TRUST ME!!! #SemST
vacanti sam glover maybe a woman should be president,FAVOR,1921,@vacanti @samglover Maybe a woman should be President.  #SemST
today love won and hate was defeated # morning joe # # united blue #,NONE,1922,Today LOVE won and Hate was defeated. #MorningJoe #UnitedBlue #SemST
"# obama # is riding high ! ! # obamacare # # love wins # # republicans # tearing out their hair , whatever is left of it next is # scotus #",NONE,1923,"#Obama is riding high!! #ObamaCare #LoveWins #Republicans tearing out their hair, whatever is left of it ..Next is #SCOTUS #SemST"
thank you hillary clinton for your support of the lgbt community on this historic day i thank you for giving us hope,FAVOR,1924,Thank you @HillaryClinton for your support of the LGBT community. On this historic day I thank you for giving us hope. #SemST
"a black president , healthcare for all , marriage equality what 's next ? a woman president ? ! damn right ! # scotus # # marriage equality #",FAVOR,1925,"A Black President,Healthcare 4 all, Marriage Equality...what's next?..a Woman President?!Damn RIGHT! #SCOTUS #MarriageEquality #SemST"
"rt murad gu der ian democrats are red , obama is a communist , i'm a true patriot , so stop hillary # t cot #",AGAINST,1926,"RT @muradguderian: Democrats are Red, Obama is a Communist, I'm a true Patriot, So stop Hillary.  #tcot #SemST"
cbs this morning emails missing and incomplete ? who 'd of thunk it ? i'm above the law and the rest of you peons ! just trust me !,AGAINST,1927,@CBSThisMorning Emails missing and incomplete? Who'd of thunk it?  I'M ABOVE THE LAW and the rest of you peons! JUST TRUST ME! #SemST
who 's monica lewinsky 's favorite football player ? ha ha clinton dix,AGAINST,1928,Who's monica Lewinsky's favorite football player? Ha-Ha Clinton Dix  #SemST
"scotus dealt a blow to hillary clinton last campaign ' promise ' what is she running on now ? corruption , lies , and deceit",AGAINST,1929,"SCOTUS dealt a blow to Hillary Clintons last campaign 'promise'... What is she running on now? Corruption, lies, and deceit. #SemST"
"do america a favor , if you feel you must vote for a woman candidate , vote for # carly 2016 # who at least has integrity unlike",AGAINST,1930,"Do America a favor, If you feel you must vote for a woman candidate, Vote for #Carly2016 who at least has integrity unlike #SemST"
getting another hillary clinton bumper sticker because # love wins # and too just was n't enough,FAVOR,1931,Getting another @HillaryClinton bumper sticker because #LoveWins and 2 just wasn't enough #SemST
pam nsc tr phr oph et rambling mother thank you for Real time strategy ! ! ! # wake up america # # dump boehner # # ditch mitch #,NONE,1932,@pamnsc @TRPhrophet @RamblingMother Thank you for RTs!!! #WakeUpAmerica #dumpboehner #ditchmitch #SemST
"ger finger pok en 2 he made a careless mistake , she deliberately broke many laws still lies about it",AGAINST,1933,"@gerfingerpoken2 he made a careless mistake, she deliberately broke many laws & still lies about it. #SemST"
very excited to hear sen klobuchar speak today !,NONE,1934,Very excited to hear Sen. Klobuchar speak today! #SemST
polit i bunny se j a 75 hub bit hillary clinton i'm voting in the democrat primary this year to support bernie sanders,AGAINST,1935,@PolitiBunny @Seja75 @hubbit @HillaryClinton I'm voting in the Democrat primary this year...to support @BernieSanders.  #SemST
my liberty depends on you being free too president obama,NONE,1936,My liberty depends on you being free too. President Obama #SemST
nro does john podest a have any grasp on reality ? i need more than 140 characters to address someone as naive as this man,NONE,1937,@NRO Does @johnpodesta have any grasp on reality? I need more than 140 characters to address someone as naive as this man. #SemST
jew boy donny oh i know he wo n't he f ke d himself over in the beginning,NONE,1938,@JewboyDonny oh I know he won't he effed himself over in the beginning  #SemST
"i called everyone i knew and raised 17 , 000 from ex boyfriends sen klobuchar",NONE,1939,"I called everyone I knew and raised $17,000 from ex-boyfriends - Sen. Klobuchar #SemST"
great that hillary clinton attended # clement a pin ck ney # 's funeral today ! !,FAVOR,1940,Great that @HillaryClinton attended #ClementaPinckney 's funeral today!! #SemST
"# wonder woman # movie , # the muppets # television show , # star wars vii # , # marriage e quail it y # # obama # i guess i can leave social media now oh wait",NONE,1941,"#WonderWoman movie, #TheMuppets TV show, #StarWarsVII, #MarriageEquaility #Obama. I guess I can leave social media now. Oh wait #SemST"
politico remember when millions of gw bush 's emails went missing or deleted reply iraq war and nobody had a hearing ? yawn !,NONE,1942,@politico Remember when millions of GWBush's emails went missing or deleted re Iraq War and nobody had a hearing? Yawn! #SemST
# love wins # on the day i get my hillary gear ! # yaa as # # pride #,FAVOR,1943,#LoveWins on the day I get my Hillary gear! #Yaaas #Pride #SemST
the girl with food though but there are people saying they just are n't going to vote at all which is ridiculous so,NONE,1944,@thegirlwithfood though. But there are people saying they just aren't going to vote at all which is ridiculous so #SemST
rt zerlina maxwell huge cheer for universal child care and early childhood education,NONE,1945,RT @ZerlinaMaxwell: Huge cheer for universal child care and early childhood education. #SemST
hillary stop pretending you were supporting the lgbt people when you opposed them until 2013 you are a lying conniving human,AGAINST,1946,Hillary: stop pretending you were supporting the LGBT people when you opposed them until 2013. You are a lying conniving human #SemST
ted cruz iam the window man get out of my state you bum ! # unite blue #,NONE,1947,@tedcruz @IamTheWindowMan  GET OUT OF MY STATE YOU BUM! #UniteBlue  #SemST
whatever is the gop going to do now with both marriage equality and the aca ? going to be fun to watch !,NONE,1948,Whatever is the GOP going to do now with both marriage equality and the ACA? Going to be fun to watch! #SemST
occupy corrupt dc she Artificial Intelligence n't no ways tired of being a dumb as s,NONE,1949,@occupycorruptDC she ain't no ways tired of being a dumbass #SemST
"i am a crook and i like it , like it , yes i do # hillary campaign slogan # # wake up america # # stop hillary 2016 # # special report #",AGAINST,1950,"I AM A CROOK...and I like it, like it, yes I do #HillaryCampaignSlogan  #WakeUpAmerica #StopHillary2016 #specialreport #SemST"
hillary clinton pretty sure you 're going to lose out on a lot of hypocritical # christian # votes by pretending to care about # lgbt #,AGAINST,1951,@HillaryClinton Pretty sure you're gonna lose out on a lot of hypocritical #Christian votes by pretending to care about #LGBT #SemST
"moving forward , our next focus should be making higher education more attainable and eliminating the gender pay gap",NONE,1952,"Moving forward, our next focus should be making higher education more attainable and eliminating the gender pay gap #SemST"
let 's shatter the glass ceiling ! gerry connolly # vade ms #,NONE,1953,Let's shatter the glass ceiling! - @GerryConnolly #VAdems #SemST
jersey kid picks thank you sir it 's an honor to hear it usa for life spread this for me # remember benghazi 2016 #,NONE,1954,@JerseyKidPicks thank you sir. It's an honor to hear it. USA for life. Spread this for me. #RememberBenghazi2016 #SemST
"let 's make secretary clinton , president clinton ag mark herring va democrats",FAVOR,1955,"Let's make Secretary Clinton, President Clinton - @AGMarkHerring @vademocrats #SemST"
i think i 'll take jeb bush over bobby jindal now and that is scary to say # bad christian values #,NONE,1956,I think I'll take @JebBush over @BobbyJindal now.. and that is scary to say.  #badchristianvalues #SemST
kim kennedy 4 thats why they still have no voting rights,NONE,1957,@kimkennedy4 thats why they still have no voting rights. #SemST
lane lewis thanks for the follow ! # the hrc super vols # for,NONE,1958,@LaneLewis Thanks for the follow! #TheHRCSuperVols for #SemST
sen kaine ( d va ) on # scotus marriage # what a great victory !,NONE,1959,"Sen. Kaine (D-VA) on #SCOTUSMarriage: ""What a great victory! #SemST"
"i am having a really tough time seeing any leaders running for potus , ques s i will have to wait and see what happens",NONE,1960,"I am having a really tough time seeing any leaders running for POTUS, quess I will have to wait and see what happens. #SemST"
hillary flew on private jet to speak to speak about income equality dinner plates were 2700 00 ! # equality for all # # pj net # # c cot #,AGAINST,1961,Hillary flew on private jet to speak to speak about Income & Equality. Dinner plates were $2700.00 ! #EqualityForAll #PJNET #CCOT #SemST
"you 're a idiot if you vote for hillary , her and obama are the epitome of what 's wrong with this country # benghazi #",AGAINST,1962,"You're a idiot if you vote for Hillary, her and Obama are The Epitome  of what's wrong with this country #Benghazi #SemST"
"despite today 's ruling , our struggle to end lgbt discrimination is also far from finished hillary clinton # virginia jj #",FAVOR,1963,"Despite today's ruling, our struggle to end LGBT discrimination is also far from finished - @HillaryClinton #VirginiaJJ #SemST"
"jeane lynn thank you so much for the follow and the favorite , jeane ! ! ! gods ' best to you ! # wake up america #",NONE,1964,"@Jeanelynn Thank you so much for the follow and the FAV, Jeane!!!  Gods' best to you! #WakeUpAmerica #SemST"
my mom just told me she and my aunt want to volunteer on hillary clinton 's campaign ! i support it !,FAVOR,1965,My mom just told me she and my aunt want to volunteer on @HillaryClinton's campaign! I support it! #SemST
let 's bring prosperity to the line workers to the kindergarten teachers ! ! ! a myk lob u char # inspired by hillary #,FAVOR,1966,Let's bring prosperity to the line workers & to the kindergarten teachers!!!- @amyklobuchar #inspiredbyhillary #SemST
"you cant fix stupid , might not be able to vote them out either",NONE,1967,"You cant fix stupid, might not be able to vote them out either. #SemST"
if i get killed thank real donald trump i was tweeting mad crap about him i do n't take it back,NONE,1968,If I get killed. Thank @realDonaldTrump . I was tweeting mad crap about him.  I don't take it back. #SemST
amazing turnout the center lv emotional crowd rt if agree love wins # fellows nv #,NONE,1969,Amazing turnout @TheCenterLV . Emotional crowd. RT if agree love wins. #FellowsNV  #SemST
meg yn kelly anytime a liberal throws around words like truth is or reality is you know they 're about to lie !,NONE,1970,"@megynkelly anytime a liberal throws around words like ""truth is"" or ""reality is"" you know they're about to LIE! #SemST"
buffalo bill 71 aram is fra in o pam nsc thank you so much for fa vs and Real time strategy ! ! ! # wake up america #,NONE,1971,@BuffaloBill71 @AramisFraino @pamnsc  Thank you so much for FAVs and RTs!!! #WakeUpAmerica #SemST
the real jena ppel Instant Message high on hashtags right now i cant help myself # my president #,NONE,1972,@therealjenappel IM HIGH ON HASHTAGS RIGHT NOW I CANT HELP MYSELF #mypresident #SemST
real donald trump why is it that your clothing line is made in china ? can you say lier pants on fire ? # morning joe # # united blue #,NONE,1973,@realDonaldTrump WHY IS IT THAT YOUR CLOTHING LINE IS MADE IN CHINA? Can U say Lier pants on fire? #morningjoe #unitedblue #SemST
slowly slowly the debt crisis will implode nations currency # america dead broke save # the dollar now,NONE,1974,SLOWLY SLOWLY THE DEBT CRISIS WILL IMPLODE NATIONS CURRENCY #AmericaDeadBrokeSAVE THE DOLLAR NOW #SemST
# america dead broke slowly # slowly china wants the yuan to replace the you is dollar as the world 's new global currency,NONE,1975,#AmericaDeadBrokeSLOWLY SLOWLY China wants the yuan to replace the U.S. dollar as the world's new global currency. #SemST
hrc snow shovel it must be hard work burying the hillary clinton anti lgbt rights record # love wins # # feel the bern #,AGAINST,1976,@HRCSnowShovel it must be hard work burying the @HillaryClinton anti-LGBT rights record #LoveWins #FeelTheBern #SemST
# hillary clinton # we 've all been waiting for your rainbow striped pantsuit # fashionista # # love wins #,FAVOR,1977,#HillaryClinton We've all been waiting for your rainbow-striped pantsuit  #fashionista #LoveWins #SemST
jeb bush you are set to lose if your campaign is based on critics instead of proposing # bush fail #,NONE,1978,@JebBush you are set to lose if ur campaign is based on critics instead of proposing #bushfail #SemST
i always joke about anything political because if i were serious i 'd end up offending people and not realize it,NONE,1979,I always joke about anything political bc if I were serious I'd end up offending people and not realize it. #SemST
my dad told me he 's voting for hillary i'm so proud laughing out loud,FAVOR,1980,My dad told me he's voting for Hillary. I'm so proud. LOL #SemST
dedicated to it i think the main problem is having your foot in your mouth in the first place,NONE,1981,@dedicated_to_it i think the main problem is having your foot in your mouth in the first place. #SemST
well strung is what should happened the next time these hillary loving ass douches encounter some trees # redeye #,AGAINST,1982,Well Strung is what should happed the next time these Hillary-loving ass douches encounter some trees. #RedEye #SemST
i am just full of myself tonight # to funny # # funny # # funnier # # hilarious # # hilary duff # # quotes of the day # # quotes to live by # # quotes #,NONE,1983,I am just full of myself tonight  #tofunny #funny #funnier #hilarious #HilaryDuff #QuotesOfTheDay #quotestoliveby #quotes #SemST
if i ever meet hillary clinton i will have died and then come back to life b see i will be so happy # idol #,FAVOR,1984,If I ever meet Hillary Clinton I will have died and then come back to life b/c I will be so happy #idol #SemST
"ar for hillary hillary clinton hillary in 2016 so proud of you ! soon , we will show who we really are keep up the good work !",FAVOR,1985,"@ARForHillary @HillaryClinton @HillaryIn2016 So proud of you! Soon, we will show who we really are. Keep up the good work! #SemST"
hillary clinton i 'd ask # hillary clinton # to stop lying about # benghazi # # clinton foundation # ties to # terrorist # # muslim # # isis #,AGAINST,1986,@HillaryClinton I'd ask #HillaryClinton to stop lying about #Benghazi & #ClintonFoundation ties to #terrorist #muslim #ISIS. #SemST
hillary clinton you flip flopped on the gay marriage issue must be more votes available with your current view ?,AGAINST,1987,@HillaryClinton You Flip/Flopped on the Gay marriage issue; must be more votes available with your current view? #SemST
"hillary clinton more lies and hypocrisy as senator of ny , you clearly said you were opposed to gay marriage",AGAINST,1988,"@HillaryClinton More lies and hypocrisy. As senator of NY, you clearly said you were opposed to gay marriage. #SemST"
hillary clinton you have proven your dishonesty once again in flip flopping on this issue people know you were opposed before,AGAINST,1989,@HillaryClinton You have proven your dishonesty once again in flip flopping on this issue. People know you were opposed before. #SemST
lauren edi cill o nbc news dl 34 l and why are major media outlets not exposing hillary 's blatant flip flopping on this issue,AGAINST,1990,@LaureneDiCillo @NBCNews @dl34l And why are major media outlets not exposing Hillary's blatant flip flopping on this issue. #SemST
who's ready for a day of action ? ! i know i am ! # fellows sc #,NONE,1991,WHO'S READY FOR A DAY OF ACTION?! I know I am! #FellowsSC #SemST
drudge report we have n't even had the elections yet,NONE,1992,@DRUDGE_REPORT We haven't even had the elections yet. #SemST
"96 commit cards collected for hillary in greenville , sc so far ! # fellows sc #",FAVOR,1993,"96 commit cards collected for Hillary in Greenville, SC so far! #FellowsSC #SemST"
"headed to chester , sc for a big hillary canvass ! join me wylie park 11 3",FAVOR,1994,"Headed to Chester, SC for a big hillary canvass! Join me. Wylie park 11-3 #SemST"
save an intern keep bill hillary out of the white house,AGAINST,1995,Save an intern.... Keep Bill & Hillary out of the White House.  #SemST
hillary clinton where are the # lgbt # pride condoms # bill clinton # used when he assaulted # monica lewinsky # ? # hillary clinton # # t lot #,AGAINST,1996,@HillaryClinton Where are the #LGBT pride condoms #BillClinton used when he assaulted #MonicaLewinsky? #HillaryClinton #tlot #SemST
fox news predicting 3 way marriage gee we have the mormons for that ! # morning joe # # united blue #,NONE,1997,Fox News predicting 3 way marriage-gee we have the Mormons for that!  #morningjoe #unitedblue #SemST
phil ad per 2014 louise katina hillary 's new campaign slogan is hillary nothing to hide but the truth ! # t cot # # wake up america #,AGAINST,1998,@philadper2014 @LouiseKatina Hillary's New Campaign slogan is:  HILLARY - NOTHING TO HIDE BUT THE TRUTH!  #tcot #WakeUpAmerica #SemST
madam president clinton you have all the gays vote # jar rid #,FAVOR,1999,Madam President Clinton; you have all the gays vote. #jarrid #SemST
debater life took me a minute to realize where this came from,NONE,2000,@debaterlife took me a minute to realize where this came from #SemST
ger finger pok en jj author one can only hope,NONE,2001,@gerfingerpoken @jjauthor one can only hope #SemST
re corwin she did n't even answer with a complete sentence laughing out loud # legend #,NONE,2002,@ReCorwin She didn't even answer with a complete sentence LOL. #Legend #SemST
"gay marriage is a minor setback for fox news tune in for a full collapse on november 8 , 2016 lots of tears and broken hearts",NONE,2003,"Gay marriage is a minor setback for Fox News. Tune in for a full collapse on November 8, 2016. Lots of tears and broken hearts. #SemST"
hillary clinton so what 's your goal for setting up victims for # bill clinton # to assault ? # hillary clinton # # chelsea s mom # # t lot #,AGAINST,2004,@HillaryClinton So what's your goal for setting up victims for #BillClinton to assault? #HillaryClinton #ChelseasMom #tlot #SemST
thanks chefs 4 hillary for amazing noms for canvassing # fit n #,FAVOR,2005,Thanks @Chefs4Hillary for amazing noms for canvassing #FITN #SemST
linda su hler and the sheep le will still vote for her,AGAINST,2006,@LindaSuhler and the sheeple will still vote for her #SemST
"one of hillary clinton 's biggest idols is margaret sanger , who called for the extermination of colored people",AGAINST,2007,"One of Hillary Clinton's biggest idols is Margaret Sanger, who called for the extermination of colored people. #SemST"
fox nation that should have been done before she got rid of it ! ! ! # no hillary 2016 #,AGAINST,2008,@foxnation That should have been done BEFORE she got rid of it!!! #NoHillary2016 #SemST
greg 61032 carmine z ozz or a ash bell perfect definition of jibberish # unite blue #,NONE,2009,@GREG61032 @CarmineZozzora @Ash_Bell__  perfect definition of JIBBERISH  #UniteBlue #SemST
"i need james carville hillary clinton to stop emailing me i love you , but i need my space # still voting for you #",FAVOR,2010,"I need @JamesCarville & @HillaryClinton to stop emailing me. I love you, but I need my space. #stillvotingforyou #SemST"
times this will cost them the 2016 election,NONE,2011,@nytimes this will cost them the 2016 election. #SemST
"hillary clinton next up for legalization your pet goat , or your # pedophile # neighbor ' dating ' the 9 year old next door",AGAINST,2012,"HillaryClinton Next up for legalization: Your pet goat, or your #pedophile neighbor 'dating' the 9 year old next door.. #SemST"
hillary clinton will # pervert # # bill clinton # be there if winner is teen girl ? # hillary clinton # # democrats # # liberals # # t lot # # gop #,AGAINST,2013,@HillaryClinton Will #pervert #BillClinton be there if winner is teen girl? #HillaryClinton #Democrats #liberals #tlot #GOP #SemST
when you favorite supports the wrong candidate ( lady gaga ) # bernie 2016 #,NONE,2014,When you fav supports the wrong candidate  (@ladygaga)  #Bernie2016 #SemST
"kool kat 14215 ha , i love your header !",NONE,2015,"@koolkat14215 Haha, I LOVE your header! #SemST"
"i hate hillary clinton and obama , please go die together thrown into the ocean get ripped into prices by sharks",AGAINST,2016,"I hate Hillary Clinton and Obama, please go die together  thrown into the ocean get ripped into prices by sharks. #SemST"
raging d Read the Rules crimson hot mess i'm for change and equality,NONE,2017,@Raging_D_RTR @CrimsonHotMess I'm for CHANGE and EQUALITY #SemST
