Tweet,Stance,Index,Original Tweet
rt gunn jessica because i want young american women to be able to be proud of the 1st woman president,FAVOR,1673,RT @GunnJessica: Because I want young American women to be able to be proud of the 1st woman president #SemST
chris 1791 news busters too years ago # hillary # never answered whether she used private email # liberal # media passed on reporting,AGAINST,1674,@Chris_1791 @newsbusters 2 years ago #Hillary never answered whether she used private email #Liberal media passed on reporting #SemST
"d new hauser take that , marco rubio gop cannot pander to the latino vote while pushing policies that hurt the community most",NONE,1675,"@dnewhauser take that, Marco Rubio. @GOP cannot pander to the Latino vote while pushing policies that hurt the community most. #SemST"
state dept amb cathy russell adam smith usa hillary clinton hillary for i a barack obama the whole # world # is supporting you,FAVOR,1676,@StateDept @AmbCathyRussell @AdamSmith_USA @HillaryClinton @HillaryforIA @BarackObama The whole #world is supporting you. #SemST
lets remember # dick cheney # is an unindicted war criminal before we start yelling # benghazi # day after day will we ever see justice ?,NONE,1677,Lets remember #dickcheney is an unindicted war criminal b4 we start yelling #Benghazi day after day. Will we ever see justice? #SemST
"although i certainly have disagreements , after reading about governor o malley i much rather have him than hillary clinton",AGAINST,1678,"Although I certainly have disagreements, after reading about @GovernorOMalley I much rather have him than @HillaryClinton. #SemST"
human rights are women 's rights and women 's rights are human rights hillary clinton,FAVOR,1679,Human rights are women's rights and women's rights are human rights. - Hillary Clinton #SemST
"would you want to be in a long term relationship with some bitch that hides her emails , lies to your face ? then # dont vote #",AGAINST,1680,"Would you wanna be in a long term relationship with some bitch that hides her emails, & lies to your face? Then #Dontvote #SemST"
bill clinton just wants to be the first dude to be president and bang one,NONE,1681,Bill Clinton just wants to be the first dude to be President and bang one. #SemST
huff post pol if hillary clinton can do half of what he did then she would be doing is a favor,FAVOR,1682,@HuffPostPol If @HillaryClinton can do half of what he did then she would be doing is a favor #SemST
"i 've made my decision , to the shock of no one probably , who i'm supporting",NONE,1683,"I've made my decision, to the shock of no one probably, who I'm supporting  #SemST"
did n't realize bob dole was mentioned in tupac 's how do you want it # yesterdays leaders #,NONE,1684,"Didn't realize Bob Dole was mentioned in Tupac's ""How do u want it"" #YesterdaysLeaders #SemST"
if i run for office this will be my original logo am # liberty not hillary # # hill no # # t cot # # unite blue #,AGAINST,1685,If I run for office this will be my original logo:          M   #libertynothillary  #HillNo #tcot #UniteBlue #SemST
i will be there when your little tree has run out of smell # that champion #,NONE,1686,I will be there when your little tree has run out of smell. #ThatChampion #SemST
crazy to think next up for the oval office is either going to be hillary or a republican,AGAINST,1687,crazy to think next up for the Oval Office is either going to be Hillary or a Republican #SemST
nacl a brasil wire same old s t obama who ? ? barack obama ? ? ) ) ) ) are you joking ? # stop dil ma # # stop lula # # stop for odesa o paulo #,NONE,1688,@NACLA @BrasilWire SOS OBAMA Who?? @BarackObama ?? :-))))  Are you joking? #StopDilma #StopLula #StopForodeSaoPaulo #SemST
cheeky gent chuck c johnson hey hillary is on her to way to buy votes too ! # hillary so old #,AGAINST,1689,@CheekyGent @ChuckCJohnson Hey Hillary is on her to way to buy votes too! #HillarySoOld #SemST
"rt nicola sturgeon it 's official hillary 's running for president , says her campaign chief excellent !",FAVOR,1690,"RT @NicolaSturgeon: ""It's official: Hillary's running for president,"" says her campaign chief. Excellent! #SemST"
only in a sexist as fuck world would we question the qualifications of a former secretary of state,FAVOR,1691,"Only in a SEXIST AS FUK world would we question the ""qualifications"" of a former SECRETARY OF STATE. #SemST"
chris christie could n't run his way out of a paper bag let alone beat # hillary clinton # go home chris you are drunk # chris christie #,FAVOR,1692,@ChrisChristie couldn't run his way out of a paper bag let alone beat #HillaryClinton. Go home Chris u r drunk. #ChrisChristie #SemST
reformed broker to the hon ies gittin money playing # bleep # words like dummies # poppa #,NONE,1693,"@ReformedBroker ""to da honies gittin money playing #bleep words like dummies"" #POPPA #SemST"
forgive # cheryl rios # of her stupid comments about women being president she will blame it on that time of the month anyways,NONE,1694,Forgive #CherylRios of her stupid comments about women being president. She will blame it on that time of the month anyways. #SemST
low key it would be interesting to have a female president,FAVOR,1695,Low key it would be interesting to have a female president. #SemST
"sean hannity we lost for , 000 of our military boys when your president pulled out of iraq # liberal consequences #",AGAINST,1696,"@seanhannity we lost 4,000 of our Military boys when your President pulled out of Iraq.  #LiberalConsequences  #SemST"
ethan obama i know it 's just going to be a long year !,NONE,1697,.@EthanObama I know - it's just going to be a long year! #SemST
"technically , a president with raging hormones could refer to estrogen , testosterone or anabolic steroids # i blame public schools #",AGAINST,1698,"Technically, a president with raging hormones could refer to estrogen, testosterone or anabolic steroids #IBlamePublicSchools #SemST"
does hillary really need to run this country ? could we just make her president of the bingo club at shady pines ? # t cot # # p2 #,AGAINST,1699,Does Hillary really need to run this country? Could we just make her president of the Bingo club at Shady Pines?  #tcot #p2 #SemST
laughing out loud why do so many people around here hate hillary ?,FAVOR,1700,Lol why do so many people around here hate Hillary?  #SemST
"hillary clinton is at the top , and has spent her whole career growing government , keeping the deck stacked # liberty not hillary #",AGAINST,1701,"@HillaryClinton is at the top, and has spent her whole career growing government, keeping the deck stacked. #LibertyNotHillary #SemST"
"problem with # libertarian # is it 's not even a decreed party a house divided against itself , will not stand think this news to",NONE,1702,"Problem with #libertarian is it's not even a decreed party. A house devided against itself, will not stand. think this news to #SemST"
hillary clinton i am portuguese and i support your campaign ! best luck ! the world need a person and a women like you ! # usa #,FAVOR,1703,@HillaryClinton i am portuguese and i support your campaign! Best luck! The world need a person and a women like you! #USA #SemST
hillary clinton for ambassador to isis,AGAINST,1704,Hillary Clinton for Ambassador to ISIS. #SemST
"so when all you brave patriots stop hillary , who you going to replace her with , jeb bush ? laughing out loud # losers #",FAVOR,1705,"So when all you brave patriots stop Hillary, who you going to replace her with, Jeb Bush? LOL. #losers #SemST"
i'm a woman can i be president ? stop hillary pac,AGAINST,1706,I'm a woman. Can I be President? @StopHillaryPAC #SemST
this is not her first time at the rodeo ! hillary clinton does n't care who likes her or not this woman is on a mission # tough #,FAVOR,1707,This is not her first time at the rodeo!  @HillaryClinton doesn't care who likes her or not This woman is on a mission #Tough #SemST
la jou et reine kar ratti paul i'm not a gen italian,NONE,1708,@lajouetreine @KarrattiPaul I'm not a Genitalian #SemST
wondering what the next idiotic gop smear against hillary clinton will be it 's coming for sure just do n't know details yet,FAVOR,1709,Wondering what the NEXT idiotic GOP smear against @HillaryClinton will be. It's coming for sure. Just don't know details yet. #SemST
hillary is killing it so far on the trail she 's finally showing her personal side and i think it will benefit her profoundly,FAVOR,1710,Hillary is killing it so far on the trail. She's finally showing her personal side and I think it will benefit her profoundly. #SemST
do we call bill mr president the first 1st man of or mr president the 1st man ? laughing out loud # im ready for hillary #,FAVOR,1711,Do we call Bill Mr President...the first 1st man of Or mr president the 1st man? Lol #imreadyforhillary #SemST
gail talk tr scoop of course it was she 'll be handled every step of the way they ca n't risk her unscripted,AGAINST,1712,.@gailtalk @trscoop Of course it was. She'll be handled every step of the way. They can't risk her unscripted. #SemST
i just want my dog to stop eating the trash,NONE,1713,I just want my dog to stop eating the trash #SemST
the hill evan perez are you kidding me leave her to focus on issues the next prez,FAVOR,1714,@thehill @evanperez are you kidding me...leave her to focus on issues...the next prez #SemST
congratulations hillary clinton on entering the 2016 race for president ! you have the support of jews all over the world !,FAVOR,1715,Congratulations @HillaryClinton on entering the 2016 race for President! You have the support of Jews all over the world! #SemST
"hillary clinton had more twitter followers then all four major republican candidates ( bush , rubio , paul , cruz ) combined",FAVOR,1716,"@HillaryClinton had more twitter followers then all four major Republican candidates (Bush, Rubio, Paul, Cruz) COMBINED. #SemST"
# hillary clinton # has yet to release clinton fd n donors public deserves disclosure # scandals # # lies # # clinton #,AGAINST,1717,#HillaryClinton has yet to release @ClintonFdn donors... Public deserves disclosure. #Scandals #lies #Clintons #SemST
i want to go back in time to when men and women could n't appear in the same yearbook as each other # old # school,NONE,1718,I want to go back in time to when men and women couldn't appear in the same yearbook as each other #old school #SemST
rt hale razor # hillary accomplishments # 1 of select few people fired for being too unethical too investigate watergate,AGAINST,1719,RT @hale_razor:#HillaryAccomplishments 1 of select few people fired 4 being 2 unethical 2 investigate Watergate #SemST
how can she live with herself ? # benghazi #,AGAINST,1720,How can she live with herself? #Benghazi #SemST
marriage equality a constitutional right ! woohoo # hrc 2016 # # hillary clinton # # ready for hillary # # vote # # hillary for 2016 # # ## m pot us #,FAVOR,1721,Marriage equality a constitutional right! Woot #HRC2016 #hillaryclinton #readyforhillary #vote #hillaryfor2016 ##mpotus #SemST
hillary needs to go to a sheetz gas station after 10 pm to see the real america,AGAINST,1722,Hillary needs to go to a Sheetz gas station after 10 pm to see the real America. #SemST
hillary 's campaign events are scripted dog pony shows designed to shelter her from vetting before the coronation,AGAINST,1723,Hillary's campaign events are scripted dog & pony shows designed to shelter her from vetting b4 the coronation #SemST
"yes , do tell us , name one of her accomplishments",AGAINST,1724,"Yes, do tell US, name one of her accomplishments #SemST"
"apparently , putting cocaine in someone 's butthole and then waiting for them to fart in your face is the wrong way to get high",NONE,1725,"Apparently, putting cocaine in someone's butthole and then waiting for them to fart in your face is the wrong way to get high. #SemST"
why is hillary lying again about something news worthy ? what 's news worthy is if she does n't lie about something,AGAINST,1726,Why is Hillary lying AGAIN about something news worthy? What's news worthy is if she doesn't lie about something #SemST
chipotle employees should n't complain hillary left nothing in the tip jar they 're lucky she did n't dip in and help herself,AGAINST,1727,Chipotle employees shouldn't complain Hillary left nothing in the tip jar. They're lucky she didn't dip in and help herself #SemST
"blue saloon women are not a demographic , we are at least 50 of the nation so a woman is no more symbolic than a man",NONE,1728,"@Bluesaloon Women are not a demographic, we are at least 50% of the nation. So a woman is no more symbolic than a man #SemST"
sending you gay bear love from chicago hillary clinton # hillary my president #,FAVOR,1729,Sending u gay bear love from Chicago @HillaryClinton #HillaryMyPresident #SemST
i love the smell of hillary in the morning it smells like republican victory # ted cruz 2016 # # marco rubio #,AGAINST,1730,I love the smell of Hillary in the morning. It smells like Republican Victory. #TedCruz2016 #MarcoRubio #SemST
pro bird rights i do a stump speech it on the stump in the park attendance mandatory,NONE,1731,@ProBirdRights: I do a stump speech. It on the stump in the park. attendance mandatory. #SemST
i 'd still rather have aaron hernandez as president than hillary,AGAINST,1732,I'd still rather have Aaron Hernandez as President than Hillary.  #SemST
jsa vol y ted cruz here yeah go teddy boy the world is getting hotter ! ! it 's called global warming ! ! you 're such a putz ! !,NONE,1733,@JSavoly @tedcruz Here ya go teddy boy..the world is getting HOTTER!! It's called GLOBAL WARMING!!  You're such a PUTZ!! #SemST
justice willett at least he has a platform,NONE,1734,@JusticeWillett at least he has a platform #SemST
"because i'm against common core , common crooks and common lies ! # no hillary 2016 # # stop hillary clinton 2016 # # why im not voting for hillary #",AGAINST,1735,"Because I'm against common core, common crooks and common lies! #NoHillary2016 #StopHillaryClinton2016 #WhyImNotVotingForHillary #SemST"
i would laughing my a off if some negro democrat decides to run for president # hillary clinton 2016 # # hillary s big announcement # # hillary s donors #,AGAINST,1736,I would LMAO if some negro Democrat decides to run for President. #HillaryClinton2016 #HillarysBigAnnouncement #HillarysDonors #SemST
"senna 1 kiri ll was here how many men are getting their dicks sucked daily in congress , etc and no one gives a shit",NONE,1737,"@senna1 @KirillWasHere how many men are getting their dicks sucked daily in congress, etc and no one gives a shit... #SemST"
"you ca n't grow an economy from the bottom up if she gets in , we 're all in trouble",AGAINST,1738,"You can't grow an economy from the bottom up. If she gets in, we're ALL in trouble #SemST"
hillary clinton stop raising taxes and let people keep more of their wages ! # liberty not hillary # # stand with rand #,AGAINST,1739,@HillaryClinton Stop raising taxes and let people keep more of their wages! #LibertyNotHillary #StandWithRand #SemST
"the blaze if you think hillary is n't taking foreign money from muslim brotherhood , you probably favor obama as chief justice",AGAINST,1740,"@theblaze If you think Hillary isn't taking foreign money from Muslim brotherhood, you probably favor Obama as chief justice #SemST"
"3 fixing america 's political system by getting rid of unaccountable money , and for protecting the country",NONE,1741,"3. Fixing America's political system by getting rid of ""unaccountable"" money, and 4. Protecting the country. #SemST"
marijuana ? mari ju a age equality ? ? coincidence i think not ! ! 11 !,NONE,1742,marijuana? marijuaage equality?? coincidence i think nOT!!11! #SemST
kori was in ger j but tawi po she also voted for the iraq war and was responsible for gathering the democrats votes to support it,AGAINST,1743,@KoriWasinger @JButtawipo she also voted for the Iraq war and was responsible for gathering @TheDemocrats votes to support it. #SemST
ding dong,NONE,1744,Ding Dong ____ _____ __ ____ #SemST
rt max tollens jr one per center lied about being # dead broke # no more lies no to,NONE,1745,RT @MaxTollensJr: One-percenter lied about being #DeadBroke No more lies. NO to #SemST
s lessard 100 agree we need a woman like hillary that can help this country get nursed back together !,FAVOR,1746,@SLessard 100% agree. We need a woman like Hillary that can help this country get nursed back together! #SemST
much like you good people i forgot about my # live tweeting bladerunner # a couple weeks ago # callback # # pot roast # # cartography # # blue #,NONE,1747,Much like you good people I forgot about my #livetweetingbladerunner a couple weeks ago #callback #potroast #cartography #blue #SemST
rand paul hillary clinton you could never dream to be as intelligent as she is,FAVOR,1748,@RandPaul @HillaryClinton you could never dream to be as intelligent as she is #SemST
"if hillary will lock americans in classrooms during her campaign , she 'll have no problems locking us all up whenever she wants",AGAINST,1749,"If Hillary will lock Americans in classrooms during her campaign, she'll have no problems locking us all up whenever she wants. #SemST"
# why im not voting for hillary # she calls education a non family enterprise # im committed 2 defeat hillary # are you ? # nc pol # gop,AGAINST,1750,"#WhyImNotVotingForHillary she calls education a ""non-family enterprise"" #ImCommitted2DefeatHillary Are you? #ncpol @GOP #SemST"
"bristol a 48 alc in i ah mahogany 1992 st phil mz diva h 67 progress 4 ohio grace slick 77 aunt lu lie deejay e dee he cool , but no",NONE,1751,"@bristola48 @AlciniaH @Mahogany1992 @stphil @MzDivah67 @Progress4Ohio @graceslick77 @AuntLulie @deejayedee He cool, but NO #SemST"
jeff nichols 82 hillary for i a # freedom # justice equality education for innovation and development to make # happy # life in utopia,FAVOR,1752,@Jeff_Nichols_82 @HillaryforIA #freedom_justice_equality_education for innovation and development to make #happy_life in Utopia #SemST
whitehouse barack obama hillary for i a barack obama the whole # world # is supporting you,FAVOR,1753,@WhiteHouse @BarackObama @HillaryforIA @BarackObama The whole #world is supporting you. #SemST
hillary clinton especially the paid union lack ies who have no idea why their there propaganda machine spinning overtime,AGAINST,1754,@HillaryClinton Especially the paid union lackies who have no idea why their there. Propaganda machine spinning overtime. #SemST
hillary clinton the deceit hand ? thats a hand you know well right ?,AGAINST,1755,@HillaryClinton The deceit hand? Thats a hand you know well. Right? #SemST
a lyss smith h there she is pant suite hillary to hide those thighs # hillary s donors # # hillary s big announcement # # benghazi # # obama #,AGAINST,1756,@AlyssSmithh There she is pant suite Hillary to hide those thighs #HillarysDonors #HillarysBigAnnouncement #Benghazi #Obama #SemST
hillary clinton will pick sen warren for vp mark my tweet # unstoppable ticket # # elizabeth warren #,FAVOR,1757,@HillaryClinton will pick @SenWarren for VP -Mark my tweet. #UnstoppableTicket #ElizabethWarren #SemST
i'm going to apply for the intern job,NONE,1758,I'm going to apply for the Intern job #SemST
thanks 1 political math then you know how slippery snakes slither over shards of glass !,NONE,1759,@TX_1 @politicalmath Then you know how slippery snakes slither over shards of glass! #SemST
46 dr house be interesting to see how hillary defends same when questioned she will eventually have to answer questions,AGAINST,1760,@46drhouse - Be interesting to see how Hillary defends same when questioned.  She will eventually have to answer questions. #SemST
hillary clinton what 's the ambient temperature in # hell # today ? use that as a guide !,AGAINST,1761,.@HillaryClinton What's the ambient temperature in #Hell today? Use that as a guide!  #SemST
"gov chafee , why are you trying to make fetch happen it 's not going to happen",NONE,1762,"Gov. Chafee, why are you trying to make fetch happen. It's not going to happen. #SemST"
# everyday sexism # only a tik salt may say what sexism is the rest of you all shut up,NONE,1763,#everydaysexism Only > @ATikSalt < may say what sexism is. The rest of y'all shut up. #SemST
"tj hansen o will is serious , if trump runs you 'll get a trump tattoo ? calling the donald ! !",NONE,1764,"@tjhansen @owillis serious, if trump runs you'll get a trump tattoo? Calling the Donald!! #SemST"
"everything about hillary clinton is bogus her issues , her history , her # iowa # trip , her # twitter # followers , her campaigning",AGAINST,1765,"Everything abt @HillaryClinton is BOGUS. Her issues, her history, her #Iowa trip, her #Twitter followers, her campaigning #SemST"
# hillary clinton # is a champion of data removal,AGAINST,1766,#hillaryclinton is a champion of data removal. #SemST
founders girl artist angie i want the first female to be competent,AGAINST,1767,@FoundersGirl @Artist_Angie I want the first female to be competent. #SemST
saudi arabia imprisons flogs rape victims women 's champion hillary clinton has accepted millions from saudi govt # t cot #,AGAINST,1768,"Saudi Arabia imprisons & flogs rape victims. ""Women's champion"" @HillaryClinton has accepted MILLIONS $$$ from Saudi govt #tcot #SemST"
how much was monica getting paid when bill 's burrito squirted sauce all over her pretty blue dress ? maur a reynolds politico,AGAINST,1769,How much was Monica getting paid when Bill's burrito squirted sauce all over her pretty blue dress? @MauraReynolds @politico #SemST
go watch america imagine a world without her it 'll make you realize how lucky we are to live in the best country on earth,NONE,1770,Go watch America: Imagine A World Without Her. It'll make you realize how lucky we are to live in the best country on Earth #SemST
i suspect hillary 's scooby doo tour is being used as a distraction from server gate et al # no obama third term #,AGAINST,1771,I suspect Hillary's Scooby Doo tour is being used as a distraction from ServerGate et al.  #NoObamaThirdTerm #SemST
breaking news # hillary # trades campaign bus for a broomstick,AGAINST,1772,Breaking News: #Hillary trades campaign bus for a broomstick. #SemST
"so cali militia 1 czar of freedom that god for global warming melting icebergs , never gets prosecuted for her crimes # liberals #",AGAINST,1773,"@SoCaliMilitia1 @CzarofFreedom  That God for global warming melting icebergs, never gets prosecuted for her crimes #Liberals #SemST"
nothing says i'm every woman like 10 democrat staffers in a machine shop in # iowa # right hillary clinton ? # not ready for hillary #,AGAINST,1774,"Nothing says ""I'm Every Woman"" like 10 Democrat staffers in a machine shop in #Iowa right @HillaryClinton? #NotReadyForHillary #SemST"
"i 'd love for some reporter to ask , second clinton , will you b returning the white house china , if elected ? or did you already hock it ?",AGAINST,1775,"I'd love for some reporter to ask, ""Sec Clinton, will u b returning the White House china, if elected? Or did u already hock it? #SemST"
very simple the clinton 's are corrupt,AGAINST,1776,Very simple: the Clinton's are corrupt. #SemST
capt yonah the hill fine unethical or illegal quid professional quo uranium deal works for me,NONE,1777,.@CaptYonah @thehill Fine; unethical or illegal quid pro quo uranium deal works for me. #SemST
con serva tv eg url those of us that also have a brain will be voting against hillary,AGAINST,1778,@ConservatveGurl those of us that also have a brain will be voting against Hillary... #SemST
life news hq tolerance at its best ! do as i say not as i do,NONE,1779,@LifeNewsHQ tolerance at its best! Do as I say not as I do #SemST
"chris 1791 truth revolt that does n't leave much to talk about , then , does it ?",NONE,1780,"@Chris_1791 @TruthRevolt That doesn't leave much to talk about, then, does it? #SemST"
i'm thinking # hillary # throws # chelsea # under the bus to end # foundation # firestorm # clinton cash # # the greater good # # election 2016 #,AGAINST,1781,I'm thinking #Hillary throws #Chelsea under the bus to end #Foundation firestorm.  #ClintonCash #TheGreaterGood #election2016 #SemST
fox news # happening now # optics problem ? no the real hillary clinton has stood up # clinton cash # # i a votes #,AGAINST,1782,@FoxNews #HappeningNow optics problem? No the real Hillary Clinton has stood up #ClintonCash #IaVotes #SemST
hillary clinton you can run but you ca ' t hide # clinton foundation scandal # # clinton cash # # email gate #,AGAINST,1783,@HillaryClinton You can run but you ca't hide. #ClintonFoundationscandal #ClintonCash #emailgate #SemST
"in case of emergency , push this button to scrub server",NONE,1784,"In case of Emergency, Push THIS BUTTON to scrub server..... #SemST"
great to see my mentor rep susan davis at # dc in sd # and she 's right we have the most qualified candidate ever running for potus,FAVOR,1785,Great to see my mentor @RepSusanDavis at #DCinSD. And she's right we have the most qualified candidate ever running for POTUS. #SemST
barack obama # love # peace and peaceful coexistence of all no to violence and # terrorism #,NONE,1786,@BarackObama #Love_peace and peaceful coexistence of all no to violence and #terrorism #SemST
ready for hrc hillary clinton support encourage # hillary clinton # president # united states # world is success of women in world,FAVOR,1787,@readyforHRC @HillaryClinton  Support encourage #HillaryClinton president #UnitedStates world is success of women in  world #SemST
i bet leslie knope would be so happy about,FAVOR,1788,I bet Leslie Knope would be so happy about #SemST
