Tweet,Stance,Index,Original Tweet
"also the 400 , 000 speaking fees # hillary # took from goldman sachs for two speeches joan vennochi",AGAINST,1789,"Also the $400,000 ""speaking fees"" #Hillary took from Goldman Sachs for two ""speeches."" @Joan_Vennochi #SemST"
ready for hrc support encourage # hillary clinton # president # united states # world is success of women in world,FAVOR,1790,@readyforHRC   Support encourage #HillaryClinton president #UnitedStates world is success of women in  world #SemST
nature guy 101 mary m oriente s support encourage # hillary clinton # president # united states # world is success of women in world,FAVOR,1791,@NatureGuy101 @MaryMorientes   Support encourage #HillaryClinton president #UnitedStates world is success of women in  world #SemST
rebecca lips on # freedom # justice equality education for innovation and development to make # happy # life i utopia,NONE,1792,@rebeccalipson  #freedom_justice_equality_education for innovation and development to make #happy_life i Utopia #SemST
before leaving my dad 's i took the liberty in framing and put up the pictures he has meeting hillary and bill clinton in '92,FAVOR,1793,Before leaving my dad's I took the liberty in framing and put up the pictures he has meeting Hillary and Bill Clinton in '92 #SemST
# hillary s accomplishments # being a total cluster fuck at anything she does # ready for hillary # # unite blue # # top prog # # t pot # # lib crib #,AGAINST,1794,#HillarysAccomplishments Being a total clusterfuck at anything she does. #ReadyForHillary #UniteBlue #TopProg #TPOT #LibCrib #SemST
rt chuck nellis hillary clinton name change it 's no longer hrc it 's now hillary uranium # benghazi # clinton take note,AGAINST,1795,RT .@ChuckNellis  .@HillaryClinton name change; it's no longer HRC it's now Hillary Uranium #Benghazi Clinton. Take note. #SemST
hillary is on her way to # baltimore # to be their champion # baltimore riots #,FAVOR,1796,Hillary is on her way to #Baltimore to be their champion. #BaltimoreRiots #SemST
"take faith that almost every political entity around you , whether dissident or not , serves no good purpose # dem publicans #",AGAINST,1797,"take faith that almost every political entity around you, whether dissident or not, serves no good purpose #Dempublicans #SemST"
you do n't have to be a lawyer to know the clinton violated ethics rules,AGAINST,1798,You don't have to be a lawyer to know the Clintons violated ethics rules. #SemST
xx o a x hillary clinton mary m oriente s barack obama the whole # world # is supporting you,FAVOR,1799,@Xxoax @HillaryClinton @MaryMorientes   @BarackObama The whole #world is supporting you. #SemST
hillary clinton # freedom # justice equality education for innovation and development to make # happy # life i utopia,FAVOR,1800,@HillaryClinton #freedom_justice_equality_education for innovation and development to make #happy_life i Utopia #SemST
"so clinton fd n , i believe andrew fastow beat you to the we made mistakes , as many organizations of our size do excuse",AGAINST,1801,"So @ClintonFdn, I believe Andrew Fastow beat you to the ""we made mistakes, as many organizations of our size do"" excuse #SemST"
i'm 19 years old and care about politics and elections i feel like i'm 67 years old,NONE,1802,I'm 19 years old and care about politics and elections.... I feel like I'm 67 years old #SemST
hillary clinton i notice that you did n't condemn the lawless actions of the rioters,AGAINST,1803,@HillaryClinton I notice that you didn't condemn the lawless actions of the rioters. #SemST
obama climate change or bush ? who to blame ? hillary right wing conspiracy in baltimore # bal it more riots #,AGAINST,1804,Obama:  climate change or bush?  Who to blame...?  Hillary:  right wing conspiracy in Baltimore. #BalitmoreRiots #SemST
"was n't the original # scooby van # also full of unemployed hippies a stupid dog , who lived to meddle in other people 's business ?",AGAINST,1805,"Wasn't the original #ScoobyVan also full of unemployed hippies & a stupid dog, who lived to meddle in other people's business? #SemST"
"in 2013 clinton foundation collected 140m and spent 9m on direct aid , in 2014 they raised 500m and spent 100m on direct aid !",AGAINST,1806,"In 2013 Clinton Foundation collected $140M and spent $9M on direct aid, in 2014 they raised $500M and spent $100M on direct aid!  #SemST"
students of # baylor university # are you all ready for # marco rubio # in # 2016 # # bu # # baylor # # bears # # baylor bears # # new american century # # gop #,AGAINST,1807,Students of #BaylorUniversity are y'all ready for #MarcoRubio in #2016 #BU #Baylor #Bears #BaylorBears #NewAmericanCentury #GOP #SemST
chelsea clinton hrc do you stand for # bill clinton # assaulting teen girls too ? # ready for hillary # # hillary clinton # # clinton 2016 #,AGAINST,1808,@ChelseaClinton @HRC Do you stand for #BillClinton assaulting teen girls too? #ReadyForHillary #HillaryClinton #Clinton2016 #SemST
hey # texas state # # bobcats # i hope you all are ready for # marco rubio # # 2016 # # texas state university # # new american century # # texas # # t cot #,NONE,1809,Hey #TexasState #Bobcats I hope y'all are ready for #MarcoRubio #2016 #TexasStateUniversity #NewAmericanCentury #Texas #TCOT #SemST
the only thing that i would pay money for is to hear hillary clinton say i quit and i'm guilty that would be worth millions,AGAINST,1810,"The only thing that I would pay money for is to hear Hillary Clinton say ""I QUIT and I'm GUILTY"" that would be worth millions. #SemST"
"hillary clinton keeps sending me emails , and when i try to subscribe , i get an error message this is cancer",AGAINST,1811,"Hillary Clinton keeps sending me emails, and when I try to unsubscribe, I get an error message. THIS IS CANCER #SemST"
hillary clinton barack obama the whole # world # is supporting you,FAVOR,1812,@HillaryClinton @BarackObama The whole #world is supporting you. #SemST
"denial it works for hillary , why not the mayor of # baltimore # # democrat lies matter #",AGAINST,1813,"Denial. It works for Hillary, why not the Mayor of #Baltimore. #DemocratLiesMatter #SemST"
join the twitter movement ! rt or favorite for a mention or follow back !,NONE,1814,Join the Twitter movement! RT or fav for a mention or follow back! #SemST
wow rt greta baltimore orioles to play tomorrow but no public allowed # baltimore riots # # freddie gray # # thanks obama # # wake up america #,NONE,1815,"Wow RT ""@greta Baltimore Orioles to play tomorrow but no public allowed"" #BaltimoreRiots #FreddieGray #ThanksObama #WakeUpAmerica #SemST"
spoke to hillary clinton today in New York City wow ! so smart and impressive ! ! !,FAVOR,1816,Spoke to @HillaryClinton today in NYC. Wow! So smart and impressive!!! #SemST
hillary clinton says the millionaire politician who accepts from countries that execute gays # hypocrite # # wake up america #,AGAINST,1817,@HillaryClinton Says the millionaire politician who accepts $$$ from countries that execute gays. #Hypocrite #WakeUpAmerica #SemST
"# bernie sanders # is running for president , do n't the # democrats # already have one really old guy running ? ?",AGAINST,1818,"#BernieSanders is running for president, don't the #democrats already have one really old guy running?? #SemST"
297 days until i can register to vote ! ! 1 year 193 days until election day # rock the vote # # democrats # # every vote counts #,FAVOR,1819,297 days until I can register to vote!!1 year 193 days until Election Day #RockTheVote #democrats #everyvotecounts #SemST
theyre not thugs you # tea party # racists they are community re organizers ! ! # t cot # # baltimore riots #,NONE,1820,"THEYRE NOT ""THUGS""  YOU #TEAPARTY RACISTS THEY ARE ""COMMUNITY REORGANIZERS"" !! #TCOT #baltimoreriots #SemST"
hillary will get past the primaries cause them voters do n't think she can do any wrong but she will be beat in november,AGAINST,1821,Hillary will get past the primaries cause Dem voters don't think she can do any wrong. But she will be beat in November #SemST
hillary clinton loving the new colorful profile picture ! # love it #,FAVOR,1822,@HillaryClinton loving the new colorful profile pic! #loveit #SemST
"hillary clinton did your rich saudi donors , who execute gays , join the team ? # hypocrite # # wake up america #",AGAINST,1823,"@HillaryClinton Did your rich Saudi donors, who execute gays, join the team? #Hypocrite #WakeUpAmerica  #SemST"
"also , i finally moved to fd city today ! will be much easier to get around going forward ! # moving #",NONE,1824,"Also, I finally moved to @FDCITY today! Will be much easier to get around going forward! #moving #SemST"
i think i am going to vote for monica lewinsky 's ex boyfriends wife,FAVOR,1825,I think I am going to vote for Monica Lewinsky's Ex- boyfriends Wife #SemST
and the working american tax payer keeps on paying for the unethical liberals who want to destroy this great country of ours,AGAINST,1826,And the working american tax payer keeps on paying for the unethical liberals who want to destroy this great country of ours. #SemST
hillary clinton versus bernie sanders primary will be like the brawl over applesauce at the retirement home # ready for hillary #,FAVOR,1827,Hillary Clinton vs. Bernie Sanders primary will be like the brawl over applesauce at the retirement home. #ReadyForHillary #SemST
too many women in too many countries speak the same language of silence hillary clinton # hillary clito n # # hillary 4 women #,FAVOR,1828,Too many women in too many countries speak the same language ﾍ｢槍宅 of silence. HILLARY CLINTON #HillaryCliton #Hillary4Women #SemST
too many women in too many countries speak the same language of silence hillary clinton # hillary clito n # # hillary 4 women #,FAVOR,1829,Too many women in too many countries speak the same language  of silence. HILLARY CLINTON #HillaryCliton #Hillary4Women #SemST
"always AOL instant mess anger high , work hard , care deeply about what you believe in when you stumble , keep faith hillary clinton faith 4 hillary",FAVOR,1830,"Always aim high,work hard, & care deeply about what U believe in...when U stumble, keep faith. HILLARY CLINTON @Faith4Hillary #SemST"
"it 's time that we move from good words too good works , from sound bites too sound solutions hillary clinton # hillary clinton #",FAVOR,1831,"It's time that we move from good words 2 good works, from sound bites 2 sound solutions HILLARY CLINTON #HillaryClinton #SemST"
the democrats dnc women i'm down to help for 2016 election,FAVOR,1832,@TheDemocrats @DNCWomen I'm down to help for 2016 election. #SemST
how many poor kids could too 5 billion feed ?,NONE,1833,How many poor kids could $2.5 billion feed? #SemST
nor su 2 secret clinton docs ? gee what a surprise !,AGAINST,1834,@Norsu2 secret Clinton docs? gee WHAT a surprise! #SemST
too far real donald trump that 's just too fucking far # baltimore uprising # # obama #,NONE,1835,Too far @realDonaldTrump. That's just too fucking far. #BaltimoreUprising #Obama #SemST
hillary clinton makes nixon look like an amateur schoolboy # clinton cash # # clinton foundation # # clinton #,AGAINST,1836,Hillary Clinton makes Nixon look like an amateur schoolboy #ClintonCash #ClintonFoundation #Clinton #SemST
the hill # mama hillary # is making the case here just exclusively how to deal with complex social issues # cnn # # bbc # # mama clinton #,FAVOR,1837,@thehill #MamaHillary is making the case here & just exclusively how to deal with complex social issues. #cnn #bbc #Mamaclinton #SemST
"golden talon john man ko cassandra rules on the contrary , i am happy she will win i enjoy seeing liberal cities burn go",FAVOR,1838,".@GoldenTalon @johnmanko @CassandraRules  On the contrary, I am happy she will win. I enjoy seeing Liberal cities burn GO #SemST"
whoever is up now let it be known that support for # marco rubio # never sleeps ! we promote the # new american century # 24 7 # texas # # thanks #,AGAINST,1839,Whoever is up now let it be known that support for #MarcoRubio never sleeps! We promote the #NewAmericanCentury 24/7 #Texas #TX #SemST
slate this is why rand paul will never be potus # baltimore uprising #,NONE,1840,@Slate This is why Rand Paul will never be POTUS. #BaltimoreUprising #SemST
"poli ana no , she 's got the # black lives matter # vote with oh even talking to them most blacks are brainwashed by the democrats",AGAINST,1841,"@_Poli_Ana_ No, she's got the #BlackLivesMatter vote w/o even talking to them.  Most blacks are brainwashed by @TheDemocrats #SemST"
if you 're not watching hillary clinton 's speech right now you 're missing her drop tons of wisdom,FAVOR,1842,If you're not watching @HillaryClinton's speech right now you're missing her drop tons of wisdom. #SemST
a proper introduction of hillary clinton should begin with five words will the defendant please rise # why im not voting for hillary #,AGAINST,1843,A proper introduction of Hillary Clinton should begin with five words: Will the defendant please rise #WhyImNotVotingForHillary #SemST
yes ! community policing is answer to rebuilding trust in our communities between law enforcement and the people they serve,NONE,1844,YES! Community policing is answer to rebuilding trust in our communities between law enforcement and the people they serve. #SemST
do n't get it twisted a major presidential candidate using her first policy speech to talk about mass in car cert a ion,AGAINST,1845,Don't get it twisted. A major presidential candidate using her first policy speech to talk about mass incarcertaion. #SemST
' hillary speak ' campaign rhetoric is going to be the death of me j mark walk,AGAINST,1846,'Hillary-speak' campaign rhetoric is going to be the death of me. @jmarkwalk #SemST
hillary clinton a rainbow logo ? did you know only for of the us is gay ? ( 2010 census ) # why im not voting for hillary #,AGAINST,1847,@HillaryClinton  A Rainbow logo? Did u know only 4% of the US is gay? (2010 Census). #WhyImNotVotingForHillary #SemST
saw a bit of hillary clinton 's speech i was proud to hear her plans for policy improvements in our justice system thanks !,FAVOR,1848,Saw a bit of @HillaryClinton 's speech & I was proud to hear her plans for policy improvements in our justice system. Thanks! #SemST
anomaly 100 i'm confident that will piss off a few white anglo saxon protestants ! keep talking jeb,NONE,1849,@Anomaly100 I'm confident that will piss off a few white Anglo-Saxon Protestants!  Keep talking Jeb. #SemST
up worthy hillary clinton it should be illegal for an employer to discriminate against their workers # equality for all #,FAVOR,1850,@Upworthy @HillaryClinton It should be illegal for an employer to discriminate against their workers. #EqualityForAll #SemST
"a body camera on every cop , private servers for cabinet secretaries",NONE,1851,"A body-cam on every cop, private servers for Cabinet Secretaries. #SemST"
john kerry bal wan ika pil hillary clinton state dept tom per riel lo i did n't realize # pay to play diplomacy # was such a big hit !,AGAINST,1852,@JohnKerry @BALWANIKAPIL @HillaryClinton @StateDept @tomperriello  I didn't realize #PayToPlayDiplomacy was such a big hit!  #SemST
"vr wc texan wow , she 's one to talk",AGAINST,1853,"@VRWCTexan WOW, she's one to talk #SemST"
rt future tx leader are you all at # utep # ready for # marco rubio # in # 2016 # # miners # # lady miners # # university of texas el paso # # rubio # # new #,NONE,1854,RT @FutureTXLeader: Are y'all at #UTEP ready for #MarcoRubio in #2016 #Miners #LadyMiners #UniversityOfTexasElPaso #Rubio #New... #SemST
rt future tx leader are you all # texas tech # # red raiders # ready for # marco rubio # in # 2016 # # ttu # # texas tech university # # rubio # # texas # # and #,AGAINST,1855,RT @FutureTXLeader: Are y'all #TexasTech #RedRaiders ready for #MarcoRubio in #2016 #TTU #TexasTechUniversity #Rubio #Texas #N... #SemST
rt future tx leader who in # corpus christi # is ready for # marco rubio # in # 2016 # # hooks # # cc # # texas # # thanks # # 361 # # keep texas red # # gop # # tea #,AGAINST,1856,RT @FutureTXLeader: Who in #CorpusChristi is ready for #MarcoRubio in #2016 #Hooks #CC #Texas #TX #361 #KeepTexasRed #GOP #Tea... #SemST
"i 've been doing my reading and i do have to to say , i'm wildly impressed by hillary clinton",FAVOR,1857,"I've been doing my reading and I do have to to say, I'm wildly impressed by Hillary Clinton #SemST"
"zachary e bell thank you 4 the follow god bless you and those you love ! god bless america , may she always be the land of the free !",NONE,1858,"@zacharyebell Thank you 4the follow. God bless you and those you love! God bless America, may she always be the land of the free! #SemST"
barack obama thanks for selling out all the workers who voted for you for pushing fasttrack # sellout #,NONE,1859,@BarackObama thanks for selling out all the workers who voted for you for pushing FastTrack #sellout #SemST
as late as 2013 # hillary clinton # opposed marriage equality,AGAINST,1860,As late as 2013 #HillaryClinton opposed marriage equality. #SemST
the hill all the more reason to vote # democrat # in 2016 # aca works # # get money out # # restore the vr a # # bernie 2016 # # war on poverty #,FAVOR,1861,@thehill all the more reason to vote #Democrat in 2016. #ACAworks #GetMoneyOut #RestoreTheVRA #Bernie2016 #waronpoverty #SemST
rt glenn he gar follow if you stand against hillary in 2016 !,AGAINST,1862,RT @Glenn_Hegar: Follow if you stand against Hillary in 2016! #SemST
i can vote in 2016 after all ayy yyyy yyyy,NONE,1863,I can vote in 2016 after all ayyyyyyyyyy #SemST
"js tines 3 wooden threat open mouth , reveal heart margaret sanger , architect for black genocide larry elder the five # hillary so white #",AGAINST,1864,"@jstines3 @WoodenThreat Open mouth, reveal heart-Margaret Sanger,architect for black genocide @larryelder @TheFive #HillarySoWhite #SemST"
i'm still so happy my voter id came in the mail,NONE,1865,I'm still so happy my voter ID came in the mail  #SemST
great conversation last night with schoolbus soul zak ste ib great connections in # waverly # on my # turf # ! # fellows i a # # commit to caucus #,NONE,1866,Great convo last night w/ @schoolbus_soul & @zaksteib Great connections in #Waverly & on my #turf! #FellowsIA #CommitToCaucus #SemST
# hillary clinton # is hiring # monsanto # lawyers to help her become president the next president should n't be aided by monsanto,AGAINST,1867,#HillaryClinton is hiring #Monsanto lawyers to help her become President. The next president shouldn't be aided by Monsanto #SemST
mary m oriente s love it it happens in my world too !,NONE,1868,@marymorientes Love it. It happens in my world too! #SemST
f roque sha you get me that book yeah ?,NONE,1869,@Froquesha u get me that book yea?  #SemST
rt putter rod ingraham angle republicans everywhere are looking for someone to lead a leader not a liar,AGAINST,1870,RT @putterrod: @IngrahamAngle Republicans everywhere are looking for someone to lead. A leader not a liar. #SemST
this weekend is the hillary for america weekend of action i hope you 'll participate l # california #,FAVOR,1871,This weekend is the Hillary For America Weekend of Action & I hope you'll participate. -L #California #SemST
"it 's good that after 30 years in public service ( with zero accomplishments ) , hillary is finally ready too serve the public ! saying lol out loud",AGAINST,1872,"It's good that after 30 years in public service (with zero accomplishments), Hillary is finally ready 2 serve the public! Lolol #SemST"
"we 're out here in g town , and where are you # sc tweets #",NONE,1873,"We're out here in G-town, and where are you  #sctweets #SemST"
js tines 3 bc williams 92 # stephens # begged for his life hillary clinton madam president is begging for your vote # not a chance in hell #,AGAINST,1874,@jstines3 @bcwilliams92 #Stephens begged for his life & @HillaryClinton @Madam_President is begging for ur vote #NotAChanceInHell #SemST
rt span glis h pop thanks gop keep sending in the clowns ! it makes this upcoming election very entertaining # latinos 2016 # # rock #,NONE,1875,RT @spanglishpop: Thanks @GOP keep sending in the clowns! It makes this upcoming election very entertaining #latinos2016 #Rock... #SemST
# things you dont say as a politician # i do n't feel no ways tired go to the back of the line what difference does it make ?,NONE,1876,#ThingsYouDontSayAsAPolitician  I don't feel no ways tired. Go to the back of the line. What difference does it make?  #SemST
laughing at the republican party the best they can offer is # donald trump # and # jeb bush # ? # hillary clinton # has got this !,FAVOR,1877,Laughing at the Republican Party. The BEST they can offer is #DonaldTrump and #JebBush?   #HillaryClinton has got this! #SemST
"temp 15544 ice decay brooklyn juggler classic mouth in this context , to all practical extents and purposes ? it means",NONE,1878,"@Temp15544 @icedecay @BrooklynJuggler @classic_mouth In this context, to all practical extents and purposes? It means #SemST"
just met an awesome supporter on the cx bus ! he said hillary is one strong woman and we need that for our country # fellows nv #,FAVOR,1879,"Just met an awesome supporter on the CX bus! He said ""Hillary is one strong woman and we need that for our country."" #FellowsNV #SemST"
"hilary has lied , deleted benghazi emails , and betrayed the trust of americans scandal after scandal",AGAINST,1880,"Hilary has lied, deleted Benghazi emails, and betrayed the trust of Americans scandal after scandal. #SemST"
"hillary has lied , deleted benghazi emails , and betrayed the trust of americans scandal after scandal",AGAINST,1881,"Hillary has lied, deleted Benghazi emails, and betrayed the trust of Americans scandal after scandal. #SemST"
"in high school , decided to be the first woman president in 2016 , but i never got into politics do n't have trump 's money",NONE,1882,"In high school, decided to be the first woman president in 2016, but I never got into politics & don't have Trump's money. #SemST"
thanks izzy bugatti for participating ! we are lucky to have you here in iowa # fellows i a #,NONE,1883,Thanks @izzybugatti for participating! WE are lucky to have YOU here in Iowa. #FellowsIA #SemST
"ji levin strumpet city yes you make me proud socialism is the answer , which leads to communism we will succeed",NONE,1884,"@jilevin @strumpetcity Yes. You make me proud. Socialism is the answer, which leads to communism. We will succeed. #SemST"
"gop obamacare stays and the confederate flag goes you guys have had quite the shitty week , have n't you ?",NONE,1885,"@GOP Obamacare stays and the Confederate flag goes. You guys have had quite the shitty week, haven't you? #SemST"
come visit me at the jefferson county fair ! representative curt hanson will tell a joke and i 'll tell a story about why vote,NONE,1886,Come visit me at the Jefferson County Fair! Representative Curt Hanson will tell a joke and I'll tell a story about why vote #SemST
i'm proud to announce i support # hillary clinton # ! ! ! !,FAVOR,1887,I'm proud to announce I support #HillaryClinton!!!! #SemST
excited to be working with some great # fellows sc # this summer they 're some pretty great people that are fired up for # lets go #,NONE,1888,Excited to be working with some great #FellowsSC this summer. They're some pretty great people that are fired up for #LetsGo #SemST
federal gov ' t social spending 61 of budget federal gov ' t defense spending 22 of budget something is definitely wrong here,NONE,1889,Federal gov't social spending 61% of budget. Federal gov't defense spending 22% of budget. Something is definitely wrong here. #SemST
hillary clinton literally the greatest video i have ever seen,FAVOR,1890,@HillaryClinton literally the greatest video I have ever seen. #SemST
washington post sir sorry mae bye bharat mool Kick a Hey you par my hart is for demo cr a et and,NONE,1891,@washingtonpost sir sory mae bi bharat mool ka hu par my hart is for democraet and #SemST
chelsea clinton 's mom has got it going on ! # potus # # chelsea s mom #,FAVOR,1892,@ChelseaClinton's mom has got it going on! #POTUS #ChelseasMom #SemST
"america needs a champion ! h no thanks , hillary clinton we do n't need a champion , especially if you 're that champion",AGAINST,1893,"America needs a champion!-H  No thanks,@HillaryClinton we don't need a champion, especially if you're that ""champion"".   #SemST"
would that the rest of # us # were able to escape from # clinton # as well # clinton correctional # # hillary clinton # # escape clinton #,AGAINST,1894,Would that the rest of #us were able to escape from #Clinton as well #ClintonCorrectional #HillaryClinton #escapeClinton #SemST
hillary clinton awesome video ! vote for chelsea 's mom,FAVOR,1895,@HillaryClinton Awesome video!  Vote for Chelsea's mom. #SemST
hill i ary i provided all work related emails state dept there are work related emails you did n't provide # hill a red acted #,AGAINST,1896,Hilliary: I provided all work related emails  State Dept: There are work related emails you didn't provide  #Hillaredacted #SemST
"# carly fiori na # on # hannity # , very impressive a serious presidential candidate versus a bad actress",AGAINST,1897,"#CarlyFiorina on #hannity, very impressive. A serious presidential candidate vs. A bad actress. #SemST"
"leigh st orz js tines 3 totally agree , hillary is an incompetent scandal ridden phony",AGAINST,1898,"@LeighStorz @jstines3 Totally agree, Hillary is an incompetent scandal ridden phony. #SemST"
"this friday is , officially , political incorrectness day ! all day say whatever you want and offend everyone ! yay ! # t cot # # 2a # # pc #",NONE,1899,"This Friday is, officially, Political Incorrectness day! All day say whatever you want and offend everyone! Yay! #tcot #2A #PC  #SemST"
