Unnamed:0,sentence,ent_nut,ent_pos,ent_neg,sta_nut,sta_sup,sta_opp,senti,label
119,did you know th # scotus # is too decide if # coal # plants can keep # emitting # unlimited # mercury # too are atmosphere ? # potus # # gop # # justices #,0.10598928,0.04386723,0.10598928,2.1831898403931294,2.828428379647161,5.109492694343335,Neutral,support
120,"hmmm , what 's next reply my # bucket list # i wonder in # peace # in a # democratic # manner reply # why # i'm here ? # peace # # democracy # # goal # ?",0.09439591,0.053045325,0.09439591,3.0212739552912082,2.0985687614070447,5.014976270909745,Positive,neutral
121,is there a breeze i can catch lakefront or will i die of a heat stroke there as well ? # heatstroke #,0.11051103,0.03956969,0.11051103,2.7567223461524715,3.2836096254673155,5.738891809544182,Negative,support
122,fossil fuel investment wo n't necessarily stop climate change but it is a step in the right direction # keep it in the ground #,0.09706082,0.05125004,0.09706082,2.8902601412142115,3.3502090348847364,5.281430882013559,Positive,support
123,government trusts you to listen to the narrative but never enough to let you see the proof,0.10900054,0.041890107,0.10900054,2.6783236610509946,2.3556496745559343,5.163985029415208,Negative,neutral
124,speaker boehner jeb bush ted cruz denial is n't just a river in egypt it 's # gop # strategy # racism #,0.10347582400000001,0.04611268599999999,0.10347582400000001,2.6716142481394605,1.8677333536173035,4.888678439827394,Negative,neutral
125,"thanks susan bowen photo omani blog had fun in my home county , will be back later this summer with castell s carmen catching up for",0.10558367,0.044480935,0.10558367,2.4237212889287547,2.0077982744373406,4.836010957470935,Positive,neutral
126,loud ass thunder and three seconds of rain here # thanks obama #,0.110032625,0.040578342999999996,0.110032625,2.3848167099534447,2.4094249209933016,4.907363566028506,Negative,support
127,when your wearing sweaters in the summer,0.09977807,0.045315787,0.09977807,0.9126997195103701,1.920019063582104,3.7295166594794935,Negative,support
128,for me watching the # ideology # of # capitalism # at work is like watching a train wreck in # progress # ! # democracy # # goal # ? # future #,0.10313754,0.046522185,0.10313754,2.255581002582954,1.44962723220548,4.096608707545621,Negative,neutral
129,# technology # is a sign of how far we have come ! the # ideology # of # capitalism # is a sign of how far we have to go ! # methodology #,0.10834984,0.042420343,0.10834984,3.5097229103438488,3.6954176251428894,6.157515779515148,Positive,neutral
130,"the 1 is a # democratic # dip in deeper waters no more reply # why # i'm here , regards dion # peace # # democracy # ! # goal # ? # future # ? ? ?",0.098643064,0.049993699999999995,0.098643064,3.207695308718464,2.617756480792312,5.309774256322419,Negative,neutral
131,"after the millennials come the apocalyptic als thanks , breeders # overpopulation #",0.10759606,0.040928856,0.10759606,3.3368647559370483,3.2632048257134443,6.0615054539649975,Negative,neutral
132,a changing planet for places where climate change is taking its toll,0.11062215,0.039719199999999996,0.11062215,2.5834549059178196,3.4197942404356736,4.828585948242446,Negative,support
133,"thank you to all our 300 followers , helping us to raise awareness of # human rights # # sos europe # # prisoners of conscience # # torture #",0.10307162,0.046699405,0.10307162,3.3609758306956747,3.2248321689235726,5.984374092715727,Positive,neutral
134,"i'm blowing ac with the top off , in the middle of the night , in oregon",0.11054826,0.039604902000000004,0.11054826,2.7896034603649054,2.926147498794321,5.41637686905588,Neutral,support
135,there 's a great challenge for # leaders h hip # in # globs l opportunity # 2 search synergetic efforts with their fellows to get engaged in,0.09824759,0.050213262,0.09824759,2.5722870357336105,2.1694055756229456,4.7694370437032925,Positive,neutral
136,# seattle # 72 degrees trying to sleep with industrial fan sounds like choppers are circling the house # heatwave #,0.110166535,0.040610604,0.110166535,1.366418098428996,1.7127628641388692,4.232990795510838,Negative,support
137,"un yet another i # pray # in my own way day reply # why # i'm online , that # important # this i know ! regards dion # peace # # future #",0.09589115,0.05204112,0.09589115,3.1685239032871833,2.8070077886240634,5.529206395679799,Positive,neutral
138,"first listen , then conviction , next action dali lama on # glas to 2015 #",0.11041944,0.039591573,0.11041944,2.8492196240714485,2.805939771966853,5.297208388526168,Positive,neutral
139,brilliant talk from george mon bio t # dali # lama guardian # investment # is the key action for all on # glas to 2015 #,0.10642413,0.043378614,0.10642413,2.3300211175248293,1.8240964218345328,4.640792732462812,Positive,neutral
140,i'm burning up baby where you at ? # hanging # # hang in pl s #,0.102071114,0.04356236,0.102071114,4.6954548610736895,4.795401265338363,7.33181441583634,Negative,neutral
141,rt va run kr 842 # please # save trees for our own # survival # to fight # save our planet #,0.10352491,0.045946613,0.10352491,1.3007269400542358,1.84334785212792,3.9376840327154286,Positive,support
142,"this pope i swear , he is about to tempt my wayward ass back to the church # love # # justice #",0.11040133,0.04028658,0.11040133,2.695014671297292,2.372097471926537,5.108020253849569,Positive,neutral
143,# mission # # climate # on the road give your car a break ( by Emergency Parent Alert ) # tip #,0.110384144,0.040602505,0.110384144,1.3190051628778148,2.5877762659583325,4.12436014490435,Neutral,support
144,"raining again then Instant Message sure , it wi suddenly get warm again right after",0.10981885,0.04104933,0.10981885,1.8120070341220549,2.0523758036087973,4.461225836943784,Negative,support
145,as they say touch wood say tomorrow then i will # democratically # be back this way ! ? ! ! reply 's d # peace # really gone # democracy #,0.09938719,0.04953569,0.09938719,3.1992703211340103,2.823692403796105,5.453579515047005,Negative,neutral
146,wearing a sweater at the end of june ! # it feels like spring #,0.11040097,0.03942772,0.11040097,1.8728744305885865,2.3142961753846154,4.623764889309056,Neutral,support
147,bliss tabitha i'm sure this eco friendly pope will remember to turn off the lights on his way out # last pope # # pope for planet #,0.09809089,0.050330974,0.09809089,1.6591118892341474,1.7384697859236369,4.166232088477401,Positive,support
148,# space # is looking like major litterbug ! do they clean up the debris it 's 1500 if i litter hi way space x,0.10870629,0.040872037,0.10870629,2.299570869163788,1.503676321733331,4.560260456615146,Negative,neutral
149,real donald trump you are not very smart donald,0.109342135,0.03987308,0.109342135,3.826852661002801,3.995677573924651,6.613494657761916,Negative,neutral
150,# mission # # climate # home move your thermostat down 2c in winter and up 2c in summer # tip # # do your part #,0.10941044,0.041203618,0.10941044,2.432544872061217,3.830747045396184,5.148530964869213,Positive,support
151,riley rode r and yet james inhofe tells us that global warming is n't real,0.104537465,0.045465782,0.104537465,1.9300627906759935,2.0592241023549103,4.549696573062085,Negative,support
152,quinn 43 thanks for the follow check out Couldn't Care Less for solutions # solutions # # citizens climate lobby 2015 #,0.10421974,0.04553187,0.10421974,2.5173839814788117,3.267868764597339,5.574563621521476,Positive,support
153,# republican # party will go down in history books as party that stood in the way of # gay rights # and initiative to reverse,0.10368666,0.046152078,0.10368666,3.328980877908936,3.0079236215595966,5.839460250203197,Negative,neutral
154,bought media advertising earned media # social media # real causes do not have # bot followers # # environment # # cruelty free #,0.1051013,0.044922605,0.1051013,1.5542117592536218,2.217507505870313,4.460205750252092,Negative,support
155,carol holman heifer 109 i always said that democrats would tax the weather if they could,0.10370642,0.046122044,0.10370642,2.3405077517737616,1.6124421539188456,4.7448878975148965,Negative,neutral
156,chelsea ma gop he 's not perfect who among us is ? ) # encyclical #,0.11090507,0.03961304,0.11090507,3.836880384879462,3.5007659041017787,6.268587850177847,Negative,neutral
157,5 6 inches of rain in a day from next day there is no rain at all temperature reaches 39 see in # ahmedabad # # environment #,0.10625343,0.04405853,0.10625343,2.5780025022809827,2.8039981141244086,5.216133291453521,Neutral,support
158,go ahead aiw support strong compass global climate agreement passed # u u aga #,0.10543631,0.044672802000000005,0.10543631,2.3926931621646146,3.1026183096494546,5.27326969305276,Neutral,support
159,the last thing # australia # or the world needs are too more vast earth destroying # coal # mines ! let 's get real and fight # a us pol #,0.09642235,0.05164647,0.09642235,2.526691772208303,3.0575246923494364,5.148236007247307,Negative,support
160,"barack obama meets david attenborough , i'm so ready for this and i cannot wait ! 89 year 's old and always on form # legend #",0.097424,0.05097668,0.097424,3.7187916236187055,3.5179035304052846,5.9223023771529375,Positive,neutral
161,enjoying watching sir david attenborough and obama talk about climate change mitigation # love nature #,0.102218695,0.047281325,0.102218695,3.2226647122311127,3.1978964619855965,5.198239285857139,Positive,support
162,"attenborough ' the real problem is global ' i e not just me , or you , but us",0.11062639,0.03978222,0.11062639,2.674160642069885,3.1622222484999747,5.215270324348238,Negative,support
163,"' ' this is the planet on which we live , it 's the only one we 've got and we 've got to protect it '' # obama # # attenborough #",0.11075632,0.040070467,0.11075632,3.914424248609241,3.9035917317979902,6.371772821835173,Positive,support
164,"the natural world is part of our inheritance , we have to protect it sir at ten boro ug with potus on # bbc # # earth #",0.10948323,0.040652483999999996,0.10948323,3.1381350181516385,3.66907247205857,5.906140499793426,Positive,support
165,amazing interview with potus and david attenborough,0.10760373,0.040845565,0.10760373,3.368401791560359,3.1497498766019247,5.64833381524728,Positive,neutral
166,# vatican # will be destroyed the most vile creatures ever the creators of # islam # # sodomising # # children # # fake stine # and,0.107645646,0.040681086,0.107645646,2.5922567109840986,1.9540958172071932,5.037896309109329,Negative,neutral
167,the west com au pam mie oz we 're way behind everybody on just about everything # gay marriage # # asylum seekers #,0.103958845,0.045589738,0.103958845,2.7990060608900333,2.396103665554065,5.259420500264251,Negative,neutral
168,regards dion # peace # to you all # including # into the # future # on a clearly # known # to be # finite in nature planet # out here gone,0.10901705,0.041796423,0.10901705,2.9318120539300097,3.2741193362085976,5.656102018849607,Positive,support
169,"oh watching the # news # reply # greece # currently , it 's ( all ) # relative # reply # why # i'm here ! reply 's d # peace # # gms # # democracy # # goal # ? ? ?",0.09751585,0.05054967,0.09751585,3.6492810930157353,3.1074759826344867,5.656675684439821,Neutral,neutral
170,"tony abbott m hr still boasting on international stage of removing price on carbon , which he refers to as toxic tax # a us pol #",0.10257761,0.046603568,0.10257761,2.216545674569231,1.3483985525287892,4.405671007476836,Negative,neutral
171,we support australia 's climate roundtable which is providing a framework for sensible debate ahead of paris cop 21,0.104898855,0.045201883,0.104898855,2.1736957131952708,2.648194619403573,4.956129964476407,Positive,support
172,"if you say climate change is a myth , you may want to become a fantasy author since you already live in an alternate reality",0.101509534,0.047870502,0.101509534,3.2940556064459336,3.7305501212983687,5.943718412866168,Negative,support
173,rt abhinav khanal 700 people dead in pakistan due to heatwave,0.10800113,0.041018307000000004,0.10800113,2.1113096382024312,2.3721216099900206,4.829465375206953,Negative,support
174,glad for the millions of lives improved this week now let 's set our sights on helping millions more # immigration action #,0.103974365,0.04599394,0.103974365,3.2295282594475667,2.934794121677728,5.741149407506106,Positive,neutral
175,at what point do we rename summer the rainy season ? # cd n poli #,0.10915275,0.04003606,0.10915275,2.6184462978105816,2.9703172584148447,5.322420819521446,Neutral,support
176,"can barack obama use 866 , 615 of jet fuel on his # earth day # trip to florida ? yes he can ! ! ! my a off potus # fail #",0.10362381,0.046205387,0.10362381,2.8055303122199287,2.4745821274174733,5.080040629784043,Negative,neutral
177,honestly i do n't understand why i like california so much i'm so bad in the heat,0.11052923,0.040290095,0.11052923,3.360293689324513,2.6799839297905805,5.445292318629686,Neutral,neutral
178,inland so cal has been hot and humid all day this seems to be our summers muggy so strange,0.11082014,0.03937155,0.11082014,2.4871557230704,2.813232962477188,5.084205369214215,Negative,support
179,building renovations turn 10mm into 1 mmm over time # business # # money # # wallstreet # # enterprise # # entrepreneur # # engineering #,0.107238166,0.04275743,0.107238166,2.4784330116904467,2.2422296277377205,4.794905728501699,Positive,neutral
180,# mission # # climate # home purchase green power ( if available ) ( by Emergency Parent Alert ) # tip #,0.10944124,0.04150112,0.10944124,2.8053068451259096,4.501543738184039,5.689549193172832,Neutral,support
181,# annapurna van che s war an # says it took too years to cut through the # bureaucracy # speak to indian # government # about # pivotal 15 #,0.10037567,0.048659064,0.10037567,2.4905728281000985,2.099125064614552,4.9133360706546085,Positive,neutral
182,a dutch court has ruled that the gov must cut emissions under human rights law ! interesting # climate justice 2015 #,0.10223947,0.04715042,0.10223947,2.739499485156597,3.236173799666409,5.3264699426219515,Positive,support
183,good luck solar impulse for # flight 8 # you will do it andre borsch berg ! # solar # # solar impulse # # acton climate #,0.10830396,0.041961253,0.10830396,2.1744318784663688,2.777989403682452,4.946823559035538,Positive,support
184,population growth is only a problem because humans treat the earth like shit # go vegan # # environment #,0.11055684,0.0401245,0.11055684,2.0294870577826747,2.4550155348909177,4.7963958503162765,Negative,support
185,# kca # # vote j kt 48 id # engi e group # engi e # 9 new # cop 21 # solutions and more here,0.10030294,0.04804617,0.10030294,2.3423797840271883,1.6371878545460987,4.612695259253933,Neutral,neutral
186,there are no two sides to this discussion stop motion solo,0.110981286,0.039762236,0.110981286,2.4725730060072904,2.347035822216692,4.763712943971192,Negative,neutral
187,john watterson is attending ippc meeting to help shape the future of international greenhouse gas emission estimation methods,0.1023405,0.046902902,0.1023405,1.99164807762214,2.294375787481045,4.751312419407888,Positive,support
188,david attenborough meets barack obama on # tv n zone # interview on his life and the effects of,0.10646167,0.043938927,0.10646167,2.9650013083544384,2.4062140998503883,5.0271782403983565,Neutral,neutral
189,abc news afterward can they call tony abbott m hr and advise him he needs to act on # a us pol #,0.10694418,0.043423995,0.10694418,2.278884848407804,1.530013701669768,4.346044528654524,Neutral,neutral
190,popup incubator # innovation # of super converter on fishing boat with no more use of fossil fuel is looking for funding scheme in,0.10504985,0.044198886,0.10504985,2.0109796984541206,2.5881458131427952,4.958587832333771,Positive,support
191,cutie barack obama i do n't have much patience for anyone who denies that this challenge is real 1 too,0.10537851,0.04484281,0.10537851,2.400789196704356,1.6843923195891874,4.388379720468587,Negative,neutral
192,sa has played an instrumental role in rallying other basic countries to strengthen south south cooperation on matters around,0.101092175,0.048167586,0.101092175,3.2794860649403437,2.919323978282041,5.949085645837356,Positive,neutral
193,do # catholics # follow # god # 's word or this # pope # 's ramblings ?,0.109440774,0.039668076000000004,0.109440774,3.3105697979665014,3.441815544660969,5.901960712297338,Negative,neutral
194,dallas still has n't hit 100 this year,0.110727206,0.03928604,0.110727206,2.5996204207473994,1.8985682131616028,4.573504171033099,Neutral,neutral
195,the same people who think paul spoke for god when denouncing gays also think the current pope does not speak for god,0.1040403,0.045844376,0.1040403,3.1421951066050515,2.8795195569701124,5.6779546243911465,Negative,neutral
196,anyone else agree we should switch to concrete ? them new snazzy self lit roads in netherlands ! # electricity saving # # autobahn #,0.10874843599999999,0.041540593,0.10874843599999999,2.21479753150991,2.71590122950582,5.151954495016941,Positive,support
197,"all eyes on china , reports climate nexus plan building on agreement with us reply # emissions # expected soon # cop 21 # # ghg #",0.09639862,0.051663414000000005,0.09639862,2.3848680970984466,2.97321149133973,4.987922508755576,Neutral,support
198,reading the whale and the supercomputer on the northern front of climate change by charles wohlforth # arctic #,0.10933844,0.041142866,0.10933844,2.2536987644971194,2.912362984943261,5.048647251451243,Positive,support
199,# mission # # climate # home wash laundry in cold water ( by et power lines ) # tip # # do your part #,0.11001708,0.04049199,0.11001708,2.149532927437636,3.671409917847548,5.1434436199598625,Positive,support
200,today the kingdom of bahrain participates in the high level event on climate change at the un # un 70 #,0.10469247,0.045131378,0.10469247,2.2002292395594205,3.046472039639542,4.964569544639519,Neutral,support
201,"president tong tells story of vulnerability resilience of # kiribati # , # maldives # other low lying states sids # action 2015 #",0.10682212,0.04324592,0.10682212,2.790457733895468,2.4083118652935944,5.253377733057049,Positive,neutral
202,monsignor sanchez sorondo earth is sick we need to heal it,0.10907441,0.04033432,0.10907441,1.5435043697092767,2.3908738326272,4.766054024831375,Negative,support
203,"we need to work with confidence , transparence and guided by consensus manu pul gar vidal at un pga event on # action 2015 #",0.10087367,0.04748065,0.10087367,2.3434293931330794,1.8489642547444507,4.801623009481914,Positive,neutral
204,road to # paris 2015 # # adp 2015 # co chairs ' new tool will be presented on july 24th manu pul gar vidal at un pga event on,0.09609467,0.05031742,0.09609467,2.0719981396064115,1.459690662041914,4.476728339240516,Positive,neutral
205,# equity # # financial # # solidarity # and # transparency # is what # 2015 text # needs says # fabius # at # un # # go ahead #,0.10285081,0.046706483,0.10285081,2.350055999692122,2.0322885997617464,4.82298040547275,Negative,neutral
206,can we build # thorium # # lft r # now before its 200 degrees during summer # mya c sucks #,0.10963208,0.040209994,0.10963208,1.893011351591124,2.574887027059601,4.594628945526441,Negative,support
207,what is at stake is the survival of our and next generation indigenous people youth # unga # # action 2015 # # cop 21 #,0.1095668,0.041281365,0.1095668,2.706681884915912,3.2208113220007752,5.571582811194454,Negative,support
208,stress on # water # resources threatens lives and livelihoods # an thro po cene age # # sustainable #,0.10916480000000002,0.040452413,0.10916480000000002,2.3222385373757346,2.9927282370333894,5.372170242208716,Negative,support
209,minister manu pul gar vidal about the importance of # in dc s # to build momentum to # paris 2015 # at press conference at # un #,0.09648561,0.051101714000000006,0.09648561,2.437012696367531,1.808716378071,4.81042938478545,Neutral,neutral
210,why is the pope upset ? via huff post comedy # unzipped truth # # pope francis #,0.11019686599999999,0.040455908,0.11019686599999999,2.5636317612349093,1.6541855507614185,4.792142526606993,Neutral,neutral
211,janez pot oc nik 22 the eu is spending the 300 billion collected through environmental tax on fossil fuel subsidies # al medal en #,0.089910746,0.05579964,0.089910746,2.576744122635033,3.1366609714137548,5.6141793559642075,Neutral,support
212,"these days this i # know # ! i # implemented # it years ago simply walked away but i know , regards dion # peace # # democracy # ! # goal # ? ?",0.0979712,0.05054494,0.0979712,2.7754149417942657,2.4318462183162017,5.134214114230387,Neutral,neutral
213,"# scotus # , we need to force # power # # plants # to cut # emissions # of # mercury # and other # air # pollutants as soon as possible ! # potus # # Emergency Parent Alert # # justices #",0.09907353,0.04961948,0.09907353,2.4973472905487792,3.485663785399044,5.430414506542403,Negative,support
214,the ruling by scotus is a major setback for Emergency Parent Alert the environment # dirty coal #,0.11097635,0.03977897,0.11097635,3.094679060079416,3.5312887084421627,5.823400289160162,Negative,support
215,nz stuff business time to change the government ! # fracking # # c02 # # methane # # pollution # # cancer # # health # # earthquake # # water # # leaks #,0.105788544,0.044119872000000004,0.105788544,2.3052087346461296,2.9939125919472027,5.181326850977767,Negative,support
216,# seb a mm # # seb 2015 # pr t ner explains the work of the # ipcc #,0.10385157,0.044212907999999995,0.10385157,2.2460180414767605,1.5356095149192792,4.5829810768205235,Neutral,neutral
217,suzy ji climate depot great news to arrest a regulatory agency 's flagrant over reach pathetic how little # Emergency Parent Alert # knows of,0.097231746,0.050976425,0.097231746,1.6842097419072244,2.3536148214933363,4.474364037050004,Negative,support
218,i can literally sense the global warming now,0.10887398599999999,0.039904699999999994,0.10887398599999999,1.664263996205012,1.90980794112942,4.359192198489146,Negative,support
219,st in go 100 weather patterns evolving very differently over the last few years,0.110298134,0.040498957,0.110298134,1.7992946343605491,2.092087438121591,4.565127155473658,Neutral,support
220,coldest and wettest summer in memory # mosquitoes # # mow twice a week # # br rrr #,0.106505975,0.04134105,0.106505975,2.0470173916525747,2.550755068761164,5.056925803912219,Negative,support
221,pope francis really making the rounds # pope francis #,0.11077704,0.040062747999999995,0.11077704,3.908889537242936,4.008560748151832,6.551892483353886,Positive,neutral
222,bend i coot shit who set the supreme court to evil again ?,0.11001009,0.039671704,0.11001009,2.7684558669851995,2.060718641900364,5.211427576727439,Negative,neutral
223,ballot paper posted tim farr on has my vote for leader our liberal voice will be heard # human rights act # # affordable housing #,0.09997412,0.04898843,0.09997412,2.2454184736368807,1.376593355725923,4.3740285774725685,Positive,neutral
224,i am thinking of turning the central heating off ),0.106982484,0.04068744,0.106982484,2.54842448329385,1.7060867705276657,4.537227152210923,Neutral,neutral
225,if like me you felt voiceless then listen to tim farr on # lib dem fight back # fighting for the # human rights act # # affordable housing #,0.09959938,0.04923746,0.09959938,2.6343711078212,2.2932634641316403,5.1090567163640985,Positive,neutral
226,"being an engaged mom , means voting for the climate too supporting only candidates who have a plan too act on # play in 4 climate #",0.10182757,0.04759358,0.10182757,2.3073700775088763,3.0920624394588008,4.859325816695512,Positive,support
227,we could do something the question is will we says paul r ehrlich # sustainable #,0.11082739,0.039928585,0.11082739,2.416389058970599,2.903896269253976,5.139976114136793,Neutral,support
228,"so , its 20 degrees celcius in mendoza argentina beginning of winter # mendoza #",0.110210806,0.039751492,0.110210806,1.918879275452783,2.8269593446208097,5.042042884028848,Neutral,support
229,"it does n't simply rain in houston anymore , it storms",0.11040215,0.03926234,0.11040215,3.266961145504834,3.052744937598245,5.635067272457553,Negative,support
230,i do n't care why the globe is warming i just want to stop it before there is irreparable harm # fuck politics # # science rules #,0.10717678,0.043321736,0.10717678,2.6655595282362863,2.793605876910874,5.198679137806043,Negative,support
231,world futures council man at # f sds 15 # points out absurdity of cost benefit analysis discounting future lives # sustainable #,0.09796744,0.050188377,0.09796744,2.1492859305076992,2.523867974897873,5.008341955522741,Negative,support
232,last thursday lake mead ( the largest you is reservoir ) had the lowest water level reported since 1937 # history in the making #,0.102390334,0.046939343,0.102390334,1.9993871963985717,2.547516671897444,4.934684837488866,Negative,support
233,56 here we see how environmental deterioration and human ethical degradation are closely linked # lauda to si # # environment #,0.10995133,0.040270224,0.10995133,2.8447647783701617,3.217124681068116,5.756016886069558,Negative,support
234,# mission # # climate # home defrost old fridges and freezers regularly # tip # # love our planet #,0.11020930000000001,0.039673828,0.11020930000000001,1.9427737725047307,3.124165311628352,4.771314087787442,Positive,support
235,obamacare doctors should warn global warming could make patients ' health worse # obama # # president obama # # whitehouse #,0.09728871,0.051082075,0.09728871,2.667215975720424,2.9695757178303905,5.374993224364481,Negative,support
236,"china , i had plans to work on other things today rude # eu china #",0.11032873,0.040608175,0.11032873,2.9162189329372805,3.15006366536781,5.495796044466911,Negative,neutral
