Unnamed:0,sentence,ent_nut,ent_pos,ent_neg,sta_nut,sta_sup,sta_opp,senti,label
352,scorching summers for uk by end of the century ! thank rocks i wo n't be here to suffer them ! ),0.10959473,0.041234612000000004,0.10959473,2.415140350766337,2.6905136515667527,4.978598969503233,Positive,support
353,try to create the world you want to live in dalai lama # with compassion #,0.11077052,0.04008487,0.11077052,2.7216616630930064,2.266061318975831,5.004741815959153,Positive,neutral
354,sea level rise by the end of the century ( 1 too meters ) will drown sf airport and la port i veli cog na # with compassion #,0.108254515,0.04183905,0.108254515,2.1248387118315786,2.683929864732214,5.098375601618537,Negative,support
355,climate change is an emergency stop denial and start taking steps # climate health #,0.1074412,0.043205574000000004,0.1074412,2.138741615811225,3.1711785698497836,4.6375932125017405,Negative,support
356,rt fado ben 60 when the rate of # utilization # exceeds the rate of # regeneration # then it calls for # degradation # # mi chach allen #,0.10452003,0.044558004000000005,0.10452003,2.351893177896075,1.5552991442536723,4.528524726768018,Negative,neutral
357,climate change is a solvable problem but we need to start today # h hdl 80 #,0.1101374,0.04033628,0.1101374,1.956719371860824,3.1083942532900988,4.6972297296763985,Positive,support
358,dalai lama suggests we should have schools for politicians to educate them on critical issues # with compassion # # h hdl 80 #,0.108714655,0.041833073,0.108714655,2.877614067309913,2.47154093221524,5.528617348740454,Positive,neutral
359,shalom shu li i'm guessing there was a lot less humidity back in the time of moses,0.10648699999999998,0.04379092,0.10648699999999998,1.8776603777356788,2.337045624170901,4.691822303523416,Negative,support
360,are these ominous yellow # vancouver # skies making anyone else dread our climate future ? # wildfires #,0.10827715,0.04222864,0.10827715,2.1229569186242734,2.6535387111827338,4.882507106077728,Negative,support
361,"cause and effect dry conditions , wildfires # preventable # # human caused #",0.11090969,0.039304822999999996,0.11090969,2.177377632443669,2.7494024345665014,5.202131527113873,Negative,support
362,# saving my tomorrow # hbo why are you guys not promoting this like crazy ? ? ? ? # hbo #,0.11131671,0.03925401,0.11131671,3.281079794838958,2.981329499025676,5.794754310463578,Negative,neutral
363,greenland 's ice is melting faster this summer under a dome of high pressure,0.110075876,0.040284038,0.110075876,2.3305920810855474,2.787356858755574,5.248718340292559,Neutral,support
364,david akin l raitt installing new # forest fire # navigation systems ? # no kinder morgan # # not ars and s # # cd n poli #,0.10658328,0.04324396,0.10658328,2.4008139116730423,1.9074446846068147,4.768935509986057,Neutral,neutral
365,ky j l 89 it 's crazy oklahoma is bracing for more flooding rains ( 4th cycle this year ) canada is burning,0.10304540400000001,0.046308905,0.10304540400000001,2.7348216558544998,2.8459642796057687,5.2242325896706,Negative,support
366,that awkward moment when a professional coal pr campaign has over 100k more followers than you do advanced energy # greenwashing #,0.10905703,0.041324265,0.10905703,2.171430646002364,2.5553253643350247,5.117115793870256,Negative,support
367,i'm going to side with the really smart and well educated folks on this one guys,0.10999489999999998,0.04095258,0.10999489999999998,4.0049174549103945,3.867258333297539,6.520514576285845,Positive,neutral
368,"climate change financing , cc adaptation , cc and resilience , the green economy lots of semantics as communities wait for solutions",0.103266984,0.04590395,0.103266984,2.7956741025135043,3.4876814209569247,5.531273194626359,Neutral,support
369,as s aad razz o uk the earth network wynn and reid usa is behind due to idiocy,0.10857408,0.041859195,0.10857408,2.7013595791762595,2.2719339533947176,5.205185610969963,Negative,neutral
370,tonight academy of science talk tech solutions for climate change with prof barry brook # cantor and ball towers # # canberra #,0.104898505,0.044933006,0.104898505,3.163984162017565,3.796482200944935,6.021877808960893,Neutral,support
371,revelation 1217 ero tao the snow is melting ? # t cot #,0.1020555,0.04381199,0.1020555,2.3586597984657947,1.5790832110290445,4.831903359407039,Neutral,neutral
372,wsj images like this make me fearful that the next epidemic must be coming soon # overpopulation #,0.10859478,0.04210989,0.10859478,2.8727837407631327,2.532946957717323,5.468312345572696,Negative,neutral
373,musk oka 247 musk oka 411 you 're proud of that ? # shoal lake # # boil water # # fort chip # # cancer # # vanuatu # # bala falls # # landscaping issues #,0.09739149999999999,0.049383856,0.09739149999999999,2.7996832444362036,2.2512322839348267,5.197360256060285,Negative,neutral
374,the # mn twins # game is going really fast tonight more proof of,0.11049162,0.040383674,0.11049162,3.1776522079249316,2.7850739006937646,5.729110999583683,Positive,neutral
375,noel kck tom ste yer bill nye potus further proof of,0.10511059,0.042376287,0.10511059,2.356700523071399,1.405318681014472,4.624613036380072,Neutral,neutral
376,porter the report please do n't let him win this your loyal readers support you,0.10790976,0.042737603,0.10790976,3.5086053086907025,3.3479827340970028,5.857062257984822,Positive,neutral
377,wish everyone was n't so pale this season # suntan # # baby oil # # the bachelorette #,0.11012464,0.039555848,0.11012464,2.610002083865432,2.043171717689806,4.903054352030099,Negative,neutral
378,"national announces plan to put out fire in pantry rest of the house can burn baby , burn # same old shit #",0.10777322,0.042922422,0.10777322,2.5341775986301394,2.0229338313589795,4.76050110634558,Negative,neutral
379,rent a theatre and show the movie # chasing ice # to my friends and family to spread the message of global warming # my 1500 #,0.10564681,0.044334695,0.10564681,1.2686774893023347,1.8834883765905148,4.27079945724964,Neutral,support
380,rt easy print it j a rt first king tre freak # rain # in kingston # jamaica # sudden # s ku ii 876 #,0.103210516,0.04611768,0.103210516,2.2930896598440995,1.6689187579775715,4.390335201243664,Neutral,neutral
381,stormiest 2014 2014 in ireland and uk in I love you years that saying something news climate watts up with that,0.10353708,0.046285167,0.10353708,2.5491352276989607,2.8578044136516936,5.105458106133852,Neutral,support
382,"liberal a us # wrong # # century # reply the # ipcc report # the involved # methodology # i do have to say , regards dion # peace # # ideology #",0.101130255,0.048057005,0.101130255,3.071310856891753,2.835297487467547,5.4023634584356985,Neutral,neutral
383,"# takedown the flag # # love wins # represent tectonic cultural shifts , thanks in no small part too twitter facebook imagine same for",0.10422815,0.04527463,0.10422815,3.8499159167643233,3.9027019535439935,6.542393239881814,Negative,neutral
384,i expected new zealand 's so called leaders to show leadership instead they show weak minded ignorance laggard ship,0.10383488,0.04612027,0.10383488,2.9600338543445766,2.7054550719217665,5.417839758213813,Negative,neutral
385,11 reduction is this a joke ? our govt seems to be more concerned about flag change than,0.11049306,0.040044434,0.11049306,1.871951870918372,1.153346362173184,3.977755633203373,Negative,neutral
386,until newyork london frankfurt knee deep in sea # water # nothing will happen unfccc # cop 21 # # co 95 # free parties anna borger yd,0.09628601,0.051296100000000004,0.09628601,2.6344330355116363,3.1609843208240163,5.639250621362518,Negative,support
387,"cli mat paris 2015 , the climate science forum begins today follow its progress on # c fcc 15 # # sustainable development #",0.09180639,0.054721415,0.09180639,2.2367639096433907,2.8890004850055218,5.07090921388104,Positive,support
388,we need integrated # science # with # indigenous # knowledge to understand adapt to # c fcc 15 #,0.10863945,0.04206551,0.10863945,2.6014916381830333,3.2463847292436863,5.4569305382466435,Positive,support
389,"whelan 60 while this debate goes on , yet more time is wasted # the drum #",0.11054495,0.040332362000000004,0.11054495,3.473307072480362,3.38834746955904,6.146447445961647,Negative,neutral
390,if sea levels get any higher flooding in lowlands could become dire,0.11023288,0.040455326,0.11023288,3.446733608573348,3.862396409415152,6.349244202700237,Negative,support
391,if we do n't do anything we will be the sad generation that had the opportunity to act and did n't # c fcc 15 # # journey 2015 #,0.107675076,0.042793915,0.107675076,2.6715506368552115,2.403062427711212,5.034532565926184,Negative,support
392,val laud belkacem are we the generation who knew what would happen but who did nothing ? say no ! # wakeup # # c fcc 15 #,0.10359797,0.046208112999999995,0.10359797,3.099011551759998,3.4746856647322075,5.866551474445843,Negative,support
393,"if we do not act , we will be the generation who knew , but did not move naja tvb # c fcc 15 #",0.11053156,0.039739154,0.11053156,2.000234063389351,2.3889558816149674,4.7017082073796574,Positive,support
394,the carbon clock is ticking carbon bubble # surplus gas # # carbon # # gas #,0.10809052,0.040532157,0.10809052,1.8459378166160567,2.3631923019507104,4.879289427824905,Negative,support
