Unnamed:0,sentence,ent_nut,ent_pos,ent_neg,sta_nut,sta_sup,sta_opp,senti,label
237,"went for a run , now i ca n't feel my legs and my brain feels like it 's boiling",0.11113377,0.03969507,0.11113377,2.712069593367141,1.829500527232552,4.788938160448125,Negative,neutral
238,disappointed that we are basing decisions about our very real planet on a man made currency system # scotus # # Emergency Parent Alert #,0.10672423,0.043735317999999995,0.10672423,1.68265234309597,2.2441554007738507,4.538354171546559,Negative,support
239,"# ask robert redford # beyond the national level , what can be done on the individual level to mitigate the effects of",0.107115895,0.043253213,0.107115895,2.76980795359564,3.057148895211318,5.53524185247944,Neutral,support
240,"daly deg agne 2010 red mittens canada alone needs too invest 60 billion a year , paid for by efficiency # cd n poli # # environment #",0.092407055,0.054142922,0.092407055,1.9726903785648804,2.4926561058582433,4.8769094401090145,Neutral,support
241,# cop 21 # can succeed or fail if humankind wants to survive something must be done not for nature but for humans simple,0.10355816,0.046271734,0.10355816,2.921557108222941,3.356140481661213,5.772154436652797,Positive,support
242,eco watch robert redford pope say time is now green nh 3 is ready to roll we all want machines what is holdup ? # pollution #,0.10214778,0.047250323,0.10214778,3.0436780009006985,3.310620591666396,5.62891576346659,Negative,support
243,sir david attenborough and barack obama diss gus sing the planet future the room does n't get any better than this,0.09997159,0.049023837,0.09997159,2.900016637677022,2.661371909580485,5.111797692453515,Positive,support
244,rb jr on fed up of polly s jolly 57 la we should worry about the state he 's going to leave # australia # in # nbn # fraud band # refugees #,0.10002641,0.048726900000000004,0.10002641,2.620077820445214,1.9880108820970983,4.893778803183189,Negative,neutral
245,"need to separate natural disasters from man made disasters , emphasize polluter pays , and need for loss and damage # tuvalu pm #",0.103886954,0.045784727000000004,0.103886954,2.1793182417125947,3.096063913253788,5.094932630385277,Negative,support
246,at the un with crew now ) trash is 4 toss ers,0.104147516,0.042460248,0.104147516,3.9558788374734575,4.135469249745983,6.78950745098418,Positive,neutral
247,e il on wy a 10 those items need to come back,0.10966697,0.04103356,0.10966697,2.4397483746370114,2.3511003038570024,5.027322035613468,Neutral,neutral
248,rosalind peterson addressing un on how aerosol spraying ( chem trails ) is affecting agriculture # not a debate # # engineering #,0.10577205,0.04336606,0.10577205,2.608691121328882,3.1700845940834896,5.700261725438454,Neutral,support
249,icicle 167 okay yeah that 's bad but vancouver literally never used to get this hot # lauda to si ',0.109254405,0.04137584,0.109254405,2.7197767799844086,2.7053621208126213,5.248126992204738,Negative,support
250,"feeling like # scotus # got it right , right , right then very wrong sigh # climate denial #",0.107559234,0.043051645,0.107559234,3.144088800090593,3.24391324520979,5.4152369042154636,Negative,support
251,# northwest # # heatwave # continues first time ever my tomato plants have fruit in june ! # oregon # # organic #,0.10946124,0.041312896,0.10946124,1.8979173405312253,2.174499759794505,4.517644223702374,Positive,support
252,good news # scotus # confirmed the # un # has zero authority of you is property or enforcement who cares what the elites say ! # cop 21 #,0.10798975,0.04259967,0.10798975,2.563228189298819,2.4181376241497707,5.079457651542161,Positive,neutral
253,"rob silver what are the chances , ir bro die ? # kyoto # # cpc # ? # cd n poli #",0.10790327,0.040911004,0.10790327,2.226528331200936,1.5519960324636737,4.687894773581615,Neutral,neutral
254,heid tj j d jr me wzi que mike h 6 mark linde sr father jonathan i think we found something more dangerous to america than,0.08489921,0.058515175999999995,0.08489921,2.202851753592924,1.4449273340084117,4.4990804374653965,Negative,neutral
255,every human commits original sin with it 's first out breath of co2 mankind is fallen # bible #,0.11026398,0.04007104,0.11026398,2.79021511057846,3.0664024415922384,5.442753283948723,Negative,support
256,if you do not repent your emission of co2 you will end up in hell # bible #,0.10827354,0.040441275,0.10827354,2.5905110007161314,3.1640722488632487,5.455520052564824,Negative,support
257,and onan cast his co2 into the atmosphere and committed the sin of emission # bible #,0.10879528,0.040248162999999997,0.10879528,2.0339150619485227,2.373414660754921,4.89112347978459,Negative,support
258,as the world emitted co2 water vapor built up in the atmosphere and caused the lord to send the flood in retribution # bible #,0.106726475,0.04337334,0.106726475,2.7036404415473334,3.446171445792743,5.67523994931126,Negative,support
259,"# mission # # climate # home pass your magazines on to a friend , hospital , library , or nursing home ( by gaiam ) # tip #",0.110574424,0.04023669,0.110574424,1.4199419023218618,2.86376466887696,4.435280438892876,Positive,support
260,lancet # climate health # report says we need ambitious program like marshall plan or apollo mission to tackle climate change,0.090164065,0.05611804,0.090164065,1.738163484622916,2.6996202097306394,4.383259976599828,Neutral,support
261,naughty be yot ch he is psychic too huh,0.10071799999999999,0.044824055999999994,0.10071799999999999,2.9555805058612643,2.3025573379480613,5.480607329824994,Negative,neutral
262,it 's nights like this when i'm not so fond of my long hair i just want to chop it all off ! # heatwave # # p nw girl #,0.110162556,0.039807499999999996,0.110162556,3.1385267105725942,2.6004891359190427,5.4873420080073645,Negative,neutral
263,"we are n't the dinosaurs , we 're the asteroid # earth # # extinction #",0.10483483,0.042067565,0.10483483,2.3396399877823075,2.6040526342601216,4.930997959645907,Negative,support
264,# mission # # climate # on the road drive less ( by green goddess 892 ) # tip # # impact is real #,0.10960237,0.04088688,0.10960237,2.2490999520718713,3.4665149794088115,5.014771160281384,Positive,support
265,look out for the hashtag # uk climate 2015 # for news today on how the uk is doing in both reducing emissions and adapting to,0.10708798,0.04312168,0.10708798,3.069017582217584,3.8201181495265297,5.796944569999808,Positive,support
266,pupils in p5 7 from l include n primary are participating in carbon busters project 2015 2016 ! # learning for sustainability #,0.09948482,0.04799868,0.09948482,1.665986966810567,2.191543563262164,4.5464289441987065,Positive,support
267,"around 1500 new homes being built every year in england in areas at high risk of # floods # , adding to risk from # uk climate 2015 #",0.095131785,0.052366315999999996,0.095131785,2.9820995236482712,3.979163510756508,5.827444761663934,Negative,support
268,"top down approach is not only the solution , global governments must act together with global community against",0.10662405,0.043920852,0.10662405,3.468050547349114,3.8806222046234,6.344679361342816,Negative,support
269,australia your turn to watch obama attenborough abc environment,0.11089305599999999,0.0395701,0.11089305599999999,2.708934537589612,1.9328380760134247,4.277588283399909,Neutral,neutral
270,# tony abbott # hope you 're watching president obama talking about,0.11042916,0.040521726,0.11042916,2.7687671037221624,1.986054139303004,4.6362106137541845,Positive,neutral
271,how did the # great barrier reef # look to you compared to when you dived it 60 years ago ? potus # attenborough # foreign official,0.10742696,0.0429399,0.10742696,2.564823375337252,2.8395105784436017,5.2400254993047195,Neutral,support
272,"it 's mindblowing to me to watch this , # sir david attenborough #",0.10793061,0.040989302000000005,0.10793061,3.1613916477435784,2.547325563031695,4.98282135325677,Positive,neutral
273,david attenborough being interviewed by president obama is brilliant fascinating viewing # foreign correspondent # # abc # # tunein #,0.10862659,0.04204221,0.10862659,3.621639222513498,3.2525139129622453,5.897886387982623,Positive,neutral
274,# mission # # climate # home simplify ( by be zero waste ) # tip # # do your part #,0.110598736,0.03953214,0.110598736,2.611380848982125,4.345767028077994,5.4939787467697165,Positive,support
275,"clean technology , this is your moment # innovation # # technology # # david attenborough is my hero #",0.10995062,0.04076062,0.10995062,2.3235282745952937,2.401276155151897,4.7222518953193635,Positive,support
276,attenborough d states the media needs to promote the damage of climate change how about you # bolt # ? # foreign correspondent #,0.10710401,0.04344457400000001,0.10710401,3.0997503904363994,3.85545652757334,5.59769188108485,Negative,support
277,water temperature off the atlantic coast is in the 80s in june we are like proverbial frogs in boiling water # climate #,0.11001031,0.040398285,0.11001031,1.5039695619347917,2.4179109678674418,4.3599617210098325,Negative,support
278,"the # great man # barack obama met # great man # david attenborough change seems possible , attainable listen up ! # at ten bor obama #",0.095236555,0.052377365999999995,0.095236555,2.3191245259714717,2.2110260992786768,4.292648827262329,Positive,support
279,"obama attenborough brilliant , heart felt honest why ca n't we have such a discussion here in oz # renewable # # abc # # a us pol #",0.10460439,0.045285664,0.10460439,2.971965819223926,2.6679163185337726,5.185551172722828,Positive,support
280,scary stat of the day 7 of the area of urban greenspace in england has been lost since 2001 the ccc uk,0.10565843400000001,0.044172958,0.10565843400000001,2.21143196612202,2.693889725640582,5.158869747390519,Negative,support
281,what can young people do about climate change ? change agents a gen earth ella bella c miss earth sa # youth #,0.10464828,0.04538399,0.10464828,2.280966629623076,2.9874314189660547,4.912476747459033,Neutral,support
282,met ace pti ve j m gamer or us gutted i 've missed this would have loved to hear this talk africa represented,0.099095285,0.049665100000000004,0.099095285,3.0035536458257885,2.6251432762077056,5.418207563542552,Positive,neutral
283,"everywhere we look , moderate weather seems to be going extinct # robert redford # # un #",0.109690465,0.04104843,0.109690465,2.643677293609666,2.9800403774080118,5.345706178648611,Negative,support
284,"rupert murdoch feel ! i 'll bin this one upload a newer mix in a few days see which version you like better , reply 's d # peace #",0.09547268,0.052318744,0.09547268,2.726333104023851,1.9984048297000048,4.9974347477678105,Positive,neutral
285,gina epa yes but silica dust emissions are up and little is done about it at the state level and it effects,0.107558414,0.042664855999999994,0.107558414,2.381828452364375,3.0488911732887414,5.373115893415252,Negative,support
286,# tolerance # i wonder how much more # mother # # earth # has at # methodology # levels reply our # capitalistic # # ideologies # ?,0.110346384,0.039734542000000005,0.110346384,2.8856690689530424,3.1058740908728826,5.5591932383353635,Negative,support
287,mex on u # green climate fund # projects must be long lasting lay the groundwork for low carbon development economic models,0.0940255,0.053134352,0.0940255,2.639830668528949,3.253750506802285,5.48846792713202,Positive,support
288,just in trudeau rethink fusion terry beech adam jp an kr atz jonathan wnv # engineering innovation # future green tech to deal with,0.08885966,0.05622168,0.08885966,1.6160094585369094,2.1524704178298046,4.64688035537916,Positive,support
289,i'm sick of celebrities who think being a well known actor makes them an authority on anything else # robert redford # # un #,0.10273136,0.04683888,0.10273136,2.5137901760876593,2.56094438017586,5.6035457199791585,Negative,oppose
290,man cannot change the climate of any country he adds no new element to the soil charles darwin # anthropocene #,0.10667393,0.043676555,0.10667393,2.3615167129662833,2.706095005791758,5.380254063256031,Negative,oppose
291,red scare bot simple malarkey rt ginger dr global warming climate change all a hoax communist agenda for control # sustain a bil #,0.090908155,0.0549756,0.090908155,2.7226299267527443,3.029072052420921,5.727573208970518,Negative,oppose
292,arctic ice highest in 10 years for the month of june yet no headlines # scam #,0.10957501,0.04127244,0.10957501,2.3165915047641987,2.5108522569636205,5.683290732047629,Negative,oppose
293,there has never been a better time to get the heck out of california # vaccines # # science # # gmo # # bees # # autism # # gmo # # sb 277 #,0.11016361,0.040429525,0.11016361,3.5210721874857587,3.454754389062373,6.0734279420337005,Negative,neutral
294,"noted climatologist , marine biologist , oceanographer ted danson told us 27 years ago that the oceans would be dead in 10 years",0.09081516,0.055631384000000006,0.09081516,1.4537707576440488,1.2058974324639102,4.851047225609038,Negative,oppose
295,"i bet as a species , man farts more today due to soda , carbonated beverages fast food than any other recorded era before",0.1090276,0.04089178,0.1090276,2.923863886812183,2.8455453183506423,5.551528934580675,Negative,neutral
296,"as a general rule , mandatory things of all kinds should be refused # vaccines # # gmo # # science # # bees # # fitness # # sb 277 # # nutrition #",0.109480694,0.041041076,0.109480694,3.1457812599412684,2.9649048533141658,5.659786428360188,Negative,neutral
297,"dean leh earth guardian z excellent speech ! well done showed your video to birdie , she is ready to be part of the change # rise #",0.09138998400000001,0.055177957,0.09138998400000001,2.686428655131812,2.3841776973597475,5.122819561722753,Positive,neutral
298,jody bland the real question is do you feel safe driving a prius through harrison ?,0.11092809,0.039539784,0.11092809,3.053462237385679,2.8082999092936825,5.542390091238639,Neutral,neutral
299,# trans pregnancy # # transgender # is a major reason why scientists ca n't find a cure to # cancer # # aids #,0.105442576,0.04466693,0.105442576,2.9429153490482163,2.1690651498102653,5.087996870061615,Negative,neutral
300,if this heat is killing me i do n't want to know what the poor polar bears are going through right now,0.10960789,0.04123342,0.10960789,3.2526566400875536,3.1807433456690744,5.609969522651754,Negative,support
301,when the well is dry we know the value of # water # ben franklin # acton climate # # Emergency Parent Alert #,0.108537845,0.04215558,0.108537845,1.9162418145430296,2.964266745315803,4.705979112746241,Neutral,support
302,"year old if you live in the united states right now , and do not believe in global climate change , you 're a fucking idiot # fact #",0.104574844,0.045551105999999994,0.104574844,3.082048644539926,3.5157275399383585,5.570080765931015,Negative,support
303,thanks # marc levine # # like # mike for supporting legislation on,0.11071807,0.040055178,0.11071807,2.4926844131376202,1.7369373062855986,4.892438440622992,Positive,neutral
304,# heatstroke # in sind rajasthan temperature in cres ng in frozen areas # earthquake # rain shower reduced a massive climate change,0.09912236,0.04883845,0.09912236,2.1586344820122165,2.8636424387810377,4.95997195236722,Neutral,support
305,it 's so unfortunate that the systematic destruction of our planet is merely seen to some as a political issue,0.11025014,0.040348455,0.11025014,2.1099656792628143,2.3508342574425485,4.882063858345722,Negative,support
306,people at the bar bitching about the heat and drought no one utters the words # fossil fuel # caused # elephant in the room # # denial #,0.10872193,0.04150434,0.10872193,2.7606016270615785,3.1553130433442185,5.589728140972255,Negative,support
307,"fire until dawn chris k kenny let me guess you 're a lying , rabid leftist war mist used to twisting facts to further your agenda",0.10609543,0.04360789,0.10609543,2.8994099207110224,2.514101610158884,5.339095260682764,Negative,neutral
308,heartland in st the french ? you mean the nation that builds tanks with a rear view mirror and six gears in reverse,0.10764976,0.042472214,0.10764976,1.9829754092416567,1.2604209916749924,4.1703990467460565,Negative,neutral
309,my dogs are # panting # to the beat of my music !,0.106642455,0.041070312000000005,0.106642455,3.0417577505126987,2.721663243148733,5.542224547698535,Positive,neutral
310,"a high emissions scenario would be a disaster for marine life , as well as for ourselves dr williamson",0.10948263,0.04145187,0.10948263,2.7294280918998672,3.2855461193906583,5.790278447639098,Negative,support
311,there are a lot of things that need to be done but first should be changing our mindset # water management #,0.11032297,0.04059477,0.11032297,2.799079723861094,3.292520885537674,5.227759387650711,Negative,support
312,it 's hot as s face in # seattle # this is not normal ! # hot af #,0.108809136,0.039718263,0.108809136,3.8436353930502234,3.7538284179294896,6.228010486225092,Negative,support
313,os teo math capital weather funny how you all of a sudden refer to him as a weatherman now # climate change # weather,0.10551167,0.044451535,0.10551167,1.8774724382352277,2.441539000398481,4.632542972756833,Negative,support
314,"not to worry , sediment cores prove shellfish coral will recover in just 160 , 000 years # oil and gas # # rbe # # tvp #",0.10963347,0.04042247,0.10963347,2.0559215973926404,2.5155929989969184,4.970405728636353,Neutral,support
315,have never been so outrageously grateful for a slight cool breeze drifting over my body is this the future ? # naked times #,0.11053723,0.040101632000000005,0.11053723,1.2396445978571586,1.6511615980598393,4.1475197159323365,Positive,support
316,"hey dr anthony lyn ham , please reject the adani carmichael # coal # mine and abbot point our reef and climate are at risk ! # gbr #",0.10168027,0.046995707000000005,0.10168027,1.8032077698158981,2.3689892469991736,4.645317300986863,Negative,support
317,tornado warnings for the uk this weekend and the government still chooses to ignore global warming # uk weather #,0.10410327,0.04586208,0.10410327,2.5544841738991386,2.7034751593233524,5.18225826556054,Negative,support
318,# main au declaration 2015 # watch out guys this is huge ! ! # lindau nobel #,0.10878272,0.0412976,0.10878272,2.3913815831691547,2.0437900017119395,4.406693257906075,Positive,neutral
319,# main au declaration 2015 # lets push the a genga worldwide without any fear # climate justice 2015 #,0.10253179999999999,0.046933837,0.10253179999999999,1.6079862408367984,2.1827419285185043,4.198842739041679,Positive,support
320,# main au declaration 2015 # 60 years later # lino 15 # laureates and young scientists say it is time to act,0.09397371,0.053476765999999995,0.09397371,1.5173193022787317,1.8797018856662664,4.0488202755953315,Neutral,support
321,p saint a mans well designed tax policies can help fix a number of environmental issues # it d conf # # cop 21 #,0.10178098,0.04746096,0.10178098,2.7351847248308583,3.1158670917296365,5.5878681429854975,Positive,support
322,just read scalia 's idiotic opinion overturning the Emergency Parent Alert 's carbon emissions limits planning to spend day in a seething rage,0.103364475,0.046239465,0.103364475,2.426365874880456,2.762566583212482,5.1362932698930965,Negative,support
323,do n't act as if we have another planet to live in # cop 21 #,0.11026644,0.03921762,0.11026644,3.297972561317548,3.2485547237740287,5.5733135118247805,Negative,support
324,re ince # gop clown car # a shame # gop # considers hrc emails more disconcerting than # jobs # # infrastructure # # education #,0.104979895,0.043749288,0.104979895,2.8154527207032847,2.1628095707678483,5.203600499338531,Negative,neutral
325,( 1 too ) poisoning of the # biosphere # cannot be dealt with by free market economics # tax wall street # # environment # # gmo #,0.10747913,0.04265642,0.10747913,2.4620794780918698,3.048898527559749,5.504017103376914,Negative,support
326,solar impulse i see this pick up on the rwy with the follow me andr sign it should be the other way round !,0.108007684,0.04235834,0.108007684,3.290442994203644,3.3185822414017188,6.034458208218912,Negative,neutral
327,everyone is busy building their bank accounts but one day that paper wo n't help you during massive natural calamities,0.10206172599999999,0.047269814,0.10206172599999999,2.595600426295399,2.537291450345061,4.962846770125099,Negative,support
328,you is should hold referendum prior to paris talks to gauge american support for dealing ( hopefully leading ) on,0.10443583,0.04564853,0.10443583,3.107551355898883,2.8697016841794802,5.771115153990041,Neutral,neutral
329,"audio world , look out ! there 's a new sheriff in town # audio # # music # # world # # entrepreneur # # love # # life #",0.106073566,0.044269428,0.106073566,2.9992788123100587,2.666127755853898,5.371160480274106,Positive,neutral
330,"second heatwave hits not applicable no way popping up everywhere , and floods too , record wildfires in canada , what a mess , time up !",0.10592531,0.044283964,0.10592531,3.4219602051942952,3.919433077302081,6.337451599982964,Negative,support
331,"global warming ! global warming ! global warming ! oh wait , it 's summer",0.109046176,0.04184021,0.109046176,3.457369626549984,3.176254322910379,5.665289363064487,Negative,oppose
332,gl bl warming news and the tooth fairy might be causing kids to lose teeth ! # carbon tax scam # # chem trails #,0.10683063,0.04272978,0.10683063,2.0017704586509133,2.073265978461356,5.7570382436519,Negative,oppose
333,t sgt alexander gl bl warming news and the tooth fairy might be causing kids to lose teeth ! # carbon tax scam # # chem trails #,0.10387726,0.04515393,0.10387726,1.8118107957587384,1.8284927394857933,5.615820147150128,Negative,oppose
334,brett gar rot brett gar rot gl bl warming news and the tooth fairy might be causing kids to lose teeth ! # carbon tax scam # # chem trails #,0.09622877,0.050253518,0.09622877,1.8975953936491352,1.7369889104628375,5.592678405852501,Negative,oppose
335,when did co2 become a dangerous pollutant that must be curtailed ? what do you exhale again ? # i want answers #,0.11021305,0.04007513,0.11021305,3.5794886174072573,3.685965201213659,6.480947205528285,Negative,oppose
336,we 're growing vegetables at home tell your friends and followers what you 're doing for climate ! # my change for climate #,0.10901969999999998,0.041611344,0.10901969999999998,1.9803748249186064,3.0774388032609337,4.57059754830084,Positive,support
337,"led lights , water saving toilets , showerheads , appliances etc when we renovate , we choose efficient # my change for climate #",0.10247715,0.045345187,0.10247715,1.7312341889933338,2.4433293808651237,4.4737316710817225,Positive,support
338,"evening al gore , any # democratic # thoughts as yet ? i get # bored # easy reply the # politics # of it all hop hop , regards d # peace # # gms #",0.0989867,0.049636677000000004,0.0989867,3.337690300913645,2.738906270795207,5.661621418081409,Negative,neutral
339,if there cl mate change alarmists come out in sept this year and tell me this was the hottest winter on record ill go postal,0.10132213,0.047972836,0.10132213,2.741851795937412,2.8473272770198697,5.827309412592454,Negative,oppose
340,cree clayton wonderful to find you on twitter meet masroor a a canadian working in,0.109385505,0.04117118,0.109385505,2.993889372875108,2.645225653649294,5.338360055921756,Positive,neutral
341,"potus , before we can defeat isis we first must defeat",0.110325195,0.04021173,0.110325195,3.029007808216813,2.9975736869705663,5.508012912766503,Neutral,neutral
342,# mission # # climate # home reduce reuse recycle replenish restore ( by scrap catalytic s ) # tip # # earth right now #,0.10810139999999999,0.04210666,0.10810139999999999,1.9764158199767443,3.1938435350291376,4.877908320614255,Positive,support
343,"without a place for feeding , mating and giving birth , there is no future for polar bears (",0.11047246,0.040157825,0.11047246,1.5983173751305002,2.1805074171014507,4.698272928382535,Negative,support
344,because continues to burn if this Artificial Intelligence n't a wake up call to everyone then nothing will be # vancouver # # bc wildfires #,0.10732351,0.04320418,0.10732351,2.5168114252599265,2.4317501338116947,4.925671355863597,Negative,support
345,pittsburgh had a regatta without boats river full of debris and swift currents too dangerous,0.10997718599999999,0.040656224,0.10997718599999999,2.4363550874515063,1.5550799052472941,4.6979118091719565,Negative,neutral
346,"un , decline of 50 in crop yields in developing countries ( rice , wheat , corn ) over the next 35 years , especially in the tropics",0.100246795,0.04873191599999999,0.100246795,1.9837455817475516,2.395414463246621,4.972095462949372,Negative,support
347,great meeting balboa lice and ctw igg 1 today to discuss future cities and how uk expertise can be shared applied in # china #,0.09432329,0.05280987,0.09432329,2.79267733123936,2.465071563768546,5.108718692175701,Positive,neutral
348,rep tom marino my priority is to address,0.10689283,0.04140997,0.10689283,2.8379770883334325,2.068478398929679,5.247212938270153,Neutral,neutral
349,rt media rage one of the most brilliant bullshit stories created by man to subjugate others # leftist lies is bs #,0.109178185,0.041173443,0.109178185,2.7868387454227155,2.5779824772756323,5.141715151583021,Negative,neutral
350,there is need for world economic powers to be true about climate change funding the world needs action not empty rhetorics,0.10456991,0.045516416,0.10456991,3.1496162857634347,4.315910956556508,5.908986977938367,Negative,support
351,"cops , un conferences , board room meetings till when shall this continue when innocent lives and livelihoods are lost",0.10345255,0.04624346,0.10345255,2.9580530365795834,2.739084971922146,5.4167546996605385,Negative,neutral
