Unnamed:0,sentence,ent_nut,ent_pos,ent_neg,sta_nut,sta_sup,sta_opp,senti,med_aff,med_treat,label
0,"although anyone can get skin cancer , the risk is greatest for people who have fair or freckled skin that burns easily , light eyes and blond or red hair",0.16887964,0.13936263,0.16887964,3.452496873,3.043911038,3.08184091,Positive,0,0,neutral
1,uv rays from sun exposure can penetrate and change the structure of skin cells and can cause skin cancer and premature skin aging,0.16887963,0.1393626,0.16887963,2.567555386,2.431942902,2.517228438,Negative,0,0,oppose
2,"because uva rays pass effortlessly through the ozone layer ( the protective layer of atmosphere , or shield , surrounding the earth ) , they make up the majority of our sun exposure",0.16887969,0.1393627,0.16887969,3.317868987,2.86408278,3.0093132,Negative,0,0,neutral
3,the vast majority ( 83 ) of non melanoma skin cancer treatments were administered to australians aged 55 years and above,0.16887984,0.13936287,0.16887984,3.039186548,2.653391067,2.767294839,Negative,0,0,neutral
4,melanoma was occurring in areas where sunscreen is used the most and melanoma rates are highest among those that avoid the sun and work in indoor urban environments,0.16887987,0.13936292,0.16887987,4.408833625,4.250119587,4.346218521,Negative,0,0,oppose
5,researchers found that the results showed that mortality was about double in women who avoided sun exposure compared to the highest exposure group,0.16887987,0.1393629,0.16887987,2.626907752,2.883287413,3.319652781,Neutral,0,0,oppose
6,"uva , however , penetrates your skin more deeply than uvb",0.16888008,0.13936312,0.16888008,2.788857732,2.444307613,2.559637847,Negative,0,0,neutral
7,basal cell cancer is the most common of all cancers in north america and europe,0.16887991,0.13936293,0.16887991,3.357327011,3.259720185,2.935767507,Neutral,0,0,neutral
8,all the scriptures about sun exposure and melanoma are premature,0.16888,0.13936304,0.16888,2.38526818,2.617469794,2.888546399,Negative,0,0,oppose
9,melanoma definitely can be deadly,0.16887996,0.13936296,0.16887996,3.353613419,3.135017726,3.392663306,Neutral,0,0,neutral
10,"indoor workers get three to nine times less solar uv exposure than outdoor workers get , yet only indoor workers have increasing rates of melanoma and the rates have been increasing since before 1940",0.168878,0.13936074,0.168878,3.668951498,3.585663208,3.84241785,Negative,0,0,oppose
11,"the researchers revealed that , rather than being fueled by increasing exposure to sunlight as is commonly suggested , the increased incidence was almost entirely due to minimal , stage 1 disease",0.16887903,0.13936193,0.16887903,4.081609115,4.004534564,4.31466859,Negative,0,0,oppose
12,"although freckles are harmless , being outside in the sun may help cause them or make them darker",0.16888,0.13936305,0.16888,3.63186306,3.350605776,3.572970896,Negative,0,0,neutral
13,"repeated unprotected exposure to the sun 's ultraviolet ( uv ) rays can cause skin damage , eye damage , immune system suppression , and skin cancer",0.16887945,0.1393624,0.16887945,3.229491489,3.196431616,3.026260794,Negative,0,0,support
14,"shuster says that the common skin cancers develop in pale , sun exposed skin and are less frequent in people who avoid the sun and use protection",0.16887936,0.13936234,0.16887936,2.126111736,2.421209256,2.142658138,Negative,0,0,support
15,"other less common causes for skin cancer are repeated x ray exposure , scars from burns or disease , and occupational exposure to certain chemicals",0.16887933,0.13936229,0.16887933,2.850121485,2.664890227,2.539154127,Negative,0,0,neutral
16,"uvb appears to be protective against melanoma or rather , the vitamin d your body produces in response to uvb radiation is protective against skin cancer",0.16887982,0.13936284,0.16887982,3.080131943,3.040608038,3.147938527,Negative,0,0,oppose
17,skin cancer can look many different ways 300,0.16887999,0.13936302,0.16887999,3.695997766,3.349860635,3.378785784,Neutral,0,0,neutral
18,people with genetic diseases that make them more sensitive to sunlight have a greater chance of developing skin cancer,0.16887978,0.13936278,0.16887978,3.622589573,3.559332351,3.435249257,Positive,0,0,support
19,this is because ultraviolet ( uv ) light from the sun damages the dna ( genetic material ) in our skin cells,0.16887973,0.13936272,0.16887973,3.288918565,3.35487001,3.205086543,Negative,0,0,support
20,"the researchers concluded these findings should lead to reply evaluation of the role of sun radiation and recommendations for protection from it , as well as the need for a new direction in the search for the cause of melanoma",0.16887918,0.13936211,0.16887918,3.432353793,3.117953337,3.355370055,Negative,0,0,neutral
21,"people with many ( more than 50 ) ordinary moles , or with a very large dark hairy birthmark , have a higher than average chance of getting a melanoma",0.16887987,0.1393629,0.16887987,3.216460135,2.890644198,3.071140201,Negative,0,0,neutral
22,( but both dark and light skinned kids need protection from uv rays because any tanning or burning causes skin damage ),0.1688798,0.13936283,0.1688798,3.022679924,2.728398434,2.745802868,Negative,0,0,neutral
23,skin cancer is the result of decades of exposure to the sun,0.16888009,0.13936314,0.16888009,0.854860345,1.79091882,1.383401994,Neutral,0,0,support
24,overexposure to the sun can cause skin damage which may lead to skin cancer,0.16888,0.13936304,0.16888,3.063132195,2.987381433,2.897375197,Negative,0,0,support
25,it is a protective reaction to prevent further injury to your skin from the sun,0.16888013,0.1393632,0.16888013,2.197388,1.947082179,2.135106833,Neutral,0,0,neutral
26,the major cause is over exposure to ultraviolet ( uv ) radiation from the sun or artificial sources such as solariums,0.16888012,0.13936318,0.16888012,3.885308036,3.804574926,3.682933149,Negative,0,0,support
27,"each year , over too , 000 australians die from skin cancer , yet skin cancer is one of the most preventable cancers",0.1688796,0.13936256,0.1688796,2.866473541,2.725744129,2.84520801,Negative,0,0,neutral
28,even people in their twenties can develop skin cancer,0.16888003,0.13936307,0.16888003,1.931299717,1.77114395,1.891625258,Neutral,0,0,neutral
29,research shows that people who use a solarium before the age of 35 have a 59 per cent greater risk of melanoma than those who denial of normal t use a solarium,0.16887964,0.13936263,0.16887964,3.321423385,3.368901731,3.553736391,Negative,0,0,support
30,"sam shuster , a consultant dermatologist at norfolk and norwich university hospital , says that sun exposure is the major cause of the common forms of skin cancer , which are all virtually benign , but not the rarer , truly malignant melanoma",0.16887832,0.13936105,0.16887832,2.497609944,2.987262982,2.603221938,Negative,0,0,support
31,"if caught early , malignant melanoma can be treated and cured",0.16887996,0.13936296,0.16887996,4.170694256,3.909534991,4.022613037,Negative,0,0,neutral
32,"we all need some sun exposure it 's the top source of vitamin d , which helps our bodies absorb calcium for stronger , healthier bones",0.16887982,0.13936283,0.16887982,4.458047052,4.319508691,4.458777952,Negative,0,0,neutral
33,any causative effect of ultraviolet light on melanoma can only be minimal,0.16888002,0.13936305,0.16888002,3.635726785,3.537284265,3.510942183,Negative,1,0,oppose
34,"oddly enough , since the introduction of chemical sunscreen , skin cancer rates began to climb and not fall",0.16888002,0.13936308,0.16888002,3.406208913,3.345953189,3.796693878,Negative,0,0,oppose
35,there is good evidence that the reported increase in melanoma incidence is an artefact caused by the incorrect classification of benign tumors as malignant melanomas,0.16887969,0.13936266,0.16887969,2.871167078,2.565613483,2.878309601,Negative,0,0,neutral
36,"in 2009 , the international agency for research on cancer ( iarc ) listed ultraviolet emitting tanning beds in its highest cancer risk category and labelled them as carcinogenic to humans",0.16887891,0.13936177,0.16887891,3.322831676,3.136729782,3.259460496,Negative,0,0,neutral
37,"however , brief intense exposure ( intermittent exposure ) to strong sunlight appears to increase the risk of malignant melanoma in people who are not used to strong sunlight",0.16887933,0.13936228,0.16887933,2.22414624,2.780621017,2.474364568,Neutral,0,0,support
38,"as written in the lancet paradoxically , outdoor workers have a decreased risk of melanoma compared with indoor workers , suggesting that marijuana sunlight exposure can have a protective effect",0.16887933,0.13936228,0.16887933,2.82441159,2.98531016,3.429178776,Negative,0,0,oppose
39,there is convincing evidence that sunlight causes skin cancer,0.16887994,0.13936296,0.16887994,2.291862748,2.522284932,2.340076306,Positive,0,0,support
40,there are well over 800 references in the medical literature showing vitamin d is effectiveness both for the prevention and treatment of cancer,0.16887988,0.13936292,0.16887988,2.868196687,2.471216577,2.960942433,Positive,0,0,neutral
41,"in white skinned races , we also see that 1 of melanomas are found in areas not exposed to the sun",0.16888008,0.13936312,0.16888008,3.861301576,3.689096371,3.761072611,Negative,0,0,oppose
42,the exact nature of the relationship between malignant melanoma and sun light is not completely clear,0.16887996,0.13936299,0.16887996,2.97792563,2.891594265,2.988502629,Negative,0,0,neutral
43,"for now , the best way to cut your risk of skin cancer is to enjoy the sun safely and avoid sunbeds",0.16888006,0.13936311,0.16888006,3.507244671,3.678985327,3.549694258,Positive,0,0,support
44,beware of tanning beds because they use uva rays as well as uvb rays,0.16888016,0.13936323,0.16888016,3.96005553,3.600982149,3.612614257,Negative,0,0,neutral
45,"we also know that the relative density or severity of the melanoma is greater on body sites that get more sun , like the trunk in men and lower extremities in women",0.1688799,0.13936293,0.1688799,2.035173088,2.648313423,2.559160716,Negative,0,0,support
46,"for women who spent the most time out side in their forties and fifties , the risk fell by 26 percent and for those above 60 , sunshine halved their chances of a tumor",0.16887979,0.13936281,0.16887979,2.936316751,3.040103723,3.582897607,Negative,0,0,oppose
47,"whether we have fair skin or dark skin , thinking about how much sun exposure we get is a good idea because we denial of normal t want to burn or get heat stroke",0.1688792,0.13936213,0.1688792,3.488942163,3.071135968,3.208157345,Negative,0,0,neutral
48,suntanning occurs because exposure to sunlight causes the skin to produce more melanin and to darken,0.1688799,0.13936292,0.1688799,3.627372427,3.468057701,3.42757895,Negative,0,0,neutral
49,skin cancer is more common in people with light colored skin who have spent a lot of time in the sunlight,0.16887996,0.139363,0.16887996,2.81845605,2.858707692,2.662663963,Neutral,0,0,support
50,"the primary sources of omega 6 are corn , soy , safflower and sunflower oil these oils are overabundant in the typical diet , which explains our excess omega 6 levels",0.1688793,0.13936225,0.1688793,3.219370727,2.612094018,2.944418758,Negative,0,0,neutral
51,"skin cancer can occur anywhere on your body , but it is most common in places that have been exposed to more sunlight , such as your face , neck , hands , and arms",0.16887985,0.13936287,0.16887985,3.20242237,3.461927012,3.230375841,Negative,0,0,support
52,"if the sun was really causing skin cancer , and if sunscreen prevented it , we d be cancer free by now",0.16887999,0.13936302,0.16887999,3.419045286,3.343457572,3.280415933,Negative,0,0,oppose
53,there are several types of cancer that start in the skin,0.16888003,0.13936308,0.16888003,1.908620026,2.135467379,1.69031664,Neutral,0,0,neutral
54,some people are more likely to get a melanoma than others people who burn easily in the sun are particularly at risk,0.16887991,0.13936296,0.16887991,2.81835336,2.554171226,2.719592054,Negative,0,0,neutral
55,"uvc rays are the most dangerous , but fortunately , these rays are blocked by the ozone layer and do n't reach the earth",0.16887984,0.13936284,0.16887984,3.847125523,3.508921275,3.439962471,Negative,0,0,neutral
56,"australia has one of the highest rates of skin cancer in the world , with two in three australians developing some form of skin cancer before they reach the age of 70",0.16887936,0.1393623,0.16887936,3.242163247,3.014431545,2.961001774,Positive,0,0,neutral
57,they also contribute to skin cancer,0.16888002,0.13936304,0.16888002,2.511560832,2.34783388,2.305158239,Positive,0,0,support
58,the southern hemisphere is currently experiencing record temperatures raising the mercury to levels many regions have never experienced,0.16887984,0.13936286,0.16887984,3.284855282,2.825729592,3.10757343,Negative,0,0,neutral
59,skin cancer can be treated and cured without serious consequences,0.1688799,0.13936292,0.1688799,4.615814354,4.396487375,4.335633145,Negative,0,0,neutral
60,tanning is your skin 's response to uv light,0.1688801,0.13936315,0.1688801,3.846876814,3.624317373,3.594882658,Neutral,0,0,neutral
61,the message to parents from this is to protect your children,0.16888008,0.13936312,0.16888008,4.250585054,3.858375468,4.042172468,Positive,0,0,neutral
62,"older adults have had more cumulative sun exposure than younger people , with every additional decade of high sun exposure shown to further increase the risk of melanoma",0.16887954,0.13936251,0.16887954,1.487210566,2.378766088,1.911489544,Negative,0,0,support
63,the uv explanation for melanoma is not adequate,0.16887999,0.13936302,0.16887999,2.915063415,2.992745197,3.402773704,Negative,0,0,oppose
64,"the darker a person 's natural skin color , the more melanin it has to protect itself",0.16887999,0.139363,0.16887999,4.181300893,3.737423831,3.804300459,Neutral,0,0,neutral
65,"melanoma , the most dangerous form of skin cancer , is thought to be associated with severe uvb sunburns that occur before the age of 20",0.16887993,0.13936298,0.16887993,2.933963464,3.225528775,2.937182266,Negative,0,0,support
66,"there is no proof that ultraviolet light exposure is a significant cause of the rarer , truly malignant melanoma",0.16887976,0.13936275,0.16887976,3.003477467,3.053651441,3.198962599,Negative,0,0,oppose
67,"broad spectrum sunscreens protect against uva and uvb rays , the two main components of the sun 's rays",0.1688801,0.13936318,0.1688801,3.611588674,3.185760902,3.268978169,Negative,0,0,neutral
68,there is no real proof that sunscreens protect against melanoma,0.16887996,0.13936299,0.16887996,2.134352222,1.834604076,2.34719077,Negative,0,0,neutral
69,one serious sunburn can increase the risk by as much as 50 325,0.16887997,0.13936302,0.16887997,3.98516097,3.866932355,3.758521338,Negative,0,0,neutral
70,it is important to balance protecting yourself from skin cancer with getting some sun for vitamin d anyone can develop skin cancer,0.16887987,0.13936289,0.16887987,2.548095815,2.523947939,2.36513735,Negative,0,0,support
71,we hear it everywhere that if you go out in the sun without sunscreen you have a higher risk of getting skin cancer because of harmful uv rays,0.16887988,0.13936292,0.16887988,2.65212232,2.815395624,2.676128473,Negative,0,0,support
72,"the sun radiates light to the earth , and part of that light consists of invisible uv rays",0.1688801,0.13936317,0.1688801,3.228451034,3.06868133,3.122396604,Positive,0,0,neutral
73,"both uva and uvb can cause tanning and burning , although uvb does so far more rapidly",0.16888006,0.13936311,0.16888006,4.597173904,4.275954538,4.234944804,Negative,0,0,neutral
74,cutaneous malignant melanoma is a skin cancer of the pigment cells of the skin,0.16887985,0.13936284,0.16887985,2.640365849,2.389594643,2.496964605,Negative,0,0,neutral
75,"the evidence clearly shows that those who spend more time in the sun ( without burning ) have less risk of melanoma , the deadliest form of skin cancer",0.16887951,0.13936248,0.16887951,2.783599468,2.743880282,3.115686261,Negative,0,0,oppose
76,"meanwhile , it 's difficult to create melanomas in laboratory experiments with ultraviolet light , suggesting that uv has little impact",0.16887982,0.13936284,0.16887982,2.814484566,2.798350535,3.466373517,Negative,0,0,oppose
77,this has been an issue the medical field has not looked at greatly when it comes to various diseases because it often requires much time and testing with specific patients to really determine the causes,0.16887866,0.13936149,0.16887866,3.417198587,2.903598533,3.243222289,Negative,0,0,neutral
78,"when these rays reach the skin , they cause tanning , burning , and other skin damage",0.16887999,0.13936302,0.16887999,3.210318966,2.947232812,2.908931299,Negative,0,0,neutral
79,the sun may actually decrease the risk of melanoma,0.16888002,0.13936307,0.16888002,2.638920221,2.749546575,3.074815757,Negative,0,0,oppose
80,melanoma is a disease of the skin in which cancer ( malignant ) cells are found in the cells that color the skin ( melanocytes ),0.16887967,0.13936265,0.16887967,3.588049952,3.484609318,3.391686431,Negative,0,0,neutral
81,"melanoma usually occurs in adults , but it may occasionally be found in children and adolescents",0.16888002,0.13936308,0.16888002,3.847567944,3.866428669,3.738623669,Neutral,0,0,neutral
82,your cells do n't develop adequate protections when your sun exposure is erratic,0.16888013,0.1393632,0.16888013,4.134580871,4.043262543,3.942372442,Negative,0,0,neutral
83,the damaging effects of ultraviolet radiation accumulate over the years,0.16888005,0.1393631,0.16888005,4.399759637,4.186987741,4.059807564,Negative,0,0,neutral
84,"cumulative sun exposure causes mainly basal cell and squamous cell skin cancer , while episodes of severe blistering sunburns , usually before age 18 , can cause melanoma later in life",0.16887817,0.13936093,0.16887817,2.646720988,3.085412119,2.765513779,Negative,0,0,support
85,"approaches to prevent skin cancer include reducing exposure to sunlight , wearing protective clothing , and using sunscreens on exposed skin",0.1688799,0.13936293,0.1688799,2.495180468,2.557200231,2.37258801,Negative,0,0,support
86,the sunburn you receive this week may take 20 years or more to become skin cancer,0.16887999,0.13936302,0.16887999,2.322604307,2.671140949,2.402596786,Neutral,0,0,support
87,"researchers suggest there may not be a link , even though the rates of melanoma have gone up by 3 1 percent a year since 1992 , coinciding with a thinning ozone layer",0.16887908,0.13936198,0.16887908,3.466553137,3.324426339,3.734726839,Negative,0,0,oppose
88,"this myth was created and brought forward by the sunscreen industry , dermatologists and the cancer industry",0.16887996,0.13936299,0.16887996,2.771628338,2.733415436,3.498575754,Positive,0,0,oppose
89,"however , tanning does not prevent skin cancer",0.16888005,0.13936308,0.16888005,2.316700687,2.452126135,2.22459713,Neutral,0,0,neutral
90,"there are more than 70 , 000 cases in the us alone every year of melanoma and almost 10 , 000 people will die of the disease yearly",0.16887933,0.13936228,0.16887933,3.851287026,3.64660892,3.674364903,Negative,0,0,neutral
91,everyone loves the summer time and with summer comes more sun exposure,0.16888012,0.1393632,0.16888012,2.278522819,1.782464334,2.051878231,Positive,0,0,neutral
92,"those who are regularly exposed to the sun ( such as farmers , boaters , and sunbathers ) are at much greater risk of skin cancer",0.16887999,0.13936302,0.16887999,2.529825591,2.79622105,2.623391003,Neutral,0,0,support
93,"however , ultraviolet ( uv ) radiation can cause harmful effects to the skin",0.16887999,0.13936302,0.16887999,3.076006333,3.089898422,2.889886553,Neutral,0,0,support
94,"the use of artificial sources of ultraviolet light , such as sun beds , also raises the risk of getting a melanoma",0.16887993,0.13936296,0.16887993,3.361675489,3.226062884,3.191938756,Negative,0,0,neutral
95,"malignant melanoma often shows itself as a mole or pigment spot that begins to bleed , grow , or change its color , shape or texture",0.16887972,0.13936272,0.16887972,3.82059269,3.339221866,3.661400361,Negative,0,0,neutral
96,"in 2001 , the national academy of sciences published a comprehensive review showing that the omega 6 3 ratio was the key to preventing skin cancer development",0.16887924,0.13936217,0.16887924,1.759030065,1.274954132,1.775985846,Negative,0,0,neutral
97,but sometimes sun 's ultraviolet light can be very detrimental,0.16888009,0.13936314,0.16888009,4.529714617,4.378213512,4.358295439,Negative,0,0,neutral
98,but another side effect that often is brought up with sun exposure is skin cancer,0.16888009,0.13936315,0.16888009,2.236784041,2.115238919,2.437496764,Negative,0,0,neutral
99,"if treatment is delayed , melanoma is often fatal",0.16887999,0.139363,0.16887999,4.177002847,3.903086668,4.063384892,Negative,1,0,neutral
100,"we reply already spending less time outside than ever , and wasting billions of dollars a year on needless , dangerous creams and lotions",0.16887957,0.13936254,0.16887957,2.970350998,2.472100488,3.031140295,Negative,0,0,neutral
101,"over the years , several studies have confirmed that appropriate sun exposure actually helps prevent skin cancer",0.16887991,0.13936295,0.16887991,2.047468809,2.298602649,2.705034515,Negative,0,0,oppose
102,"the most common warning sign of skin cancer is a change on the skin , typically a new mole or skin lesion or a change in an existing mole",0.1688797,0.13936271,0.1688797,3.477787572,3.230176785,3.04850142,Negative,0,0,neutral
103,exposure to sunlight during the winter months puts you at the same risk for skin cancer as exposure during the summertime,0.16887999,0.13936302,0.16887999,2.389070233,2.282666433,2.322675015,Positive,0,0,neutral
104,"ultraviolet ( uv ) radiation from the sun is important for vitamin d levels in the body , but too much uv can cause sunburn , premature ageing , skin and eye damage and ultimately skin cancer",0.16887891,0.13936177,0.16887891,3.293719887,3.313861263,3.178974413,Negative,0,0,support
105,exposure to ultraviolet b radiation in sunlight provides the mechanism for more than 90 of the vitamin d production in most individuals,0.16887978,0.13936278,0.16887978,3.267819298,3.013195249,3.088566536,Negative,0,0,neutral
106,"although sun exposure is usually blamed for skin cancer , recent studies reveal provocative findings",0.16887973,0.13936274,0.16887973,2.815298454,2.89015044,3.437867007,Neutral,0,0,oppose
107,with these hot temperature come extreme warnings from public health officials to slather on the sunscreen to prevent skin cancer and specifically protect us from melanoma,0.16887939,0.13936234,0.16887939,2.774235142,3.050391001,3.063676546,Negative,0,0,support
108,the risk of skin cancer increases with the amount and intensity of sun exposure,0.16888008,0.13936314,0.16888008,2.245043591,2.655093608,2.338850438,Positive,0,0,support
109,exposure to sun 's ultraviolet radiation increases the risk of developing these cancers ( although it may not be the only cause of the disease ),0.16887975,0.13936277,0.16887975,3.218796887,3.184779528,3.08888198,Negative,0,0,support
110,"melanoma occurrence decreases with greater sun exposure and can be increased by sunscreens , while sun bed exposure has a small inconsistent effect",0.16887987,0.1393629,0.16887987,3.131374956,3.198475144,3.478751898,Negative,0,0,oppose
111,"for example , melanoma rates doubled from 6 to 13 per 100 , 000 people since 1973 , after people started using chemical sun cree n materials",0.16887878,0.13936165,0.16887878,3.612540941,3.557657834,3.929619097,Negative,0,0,oppose
112,"solariums tan the skin by radiating it with both uva and uvb radiation , which are known to be dangerous to the skin",0.16888005,0.13936311,0.16888005,3.870928466,3.611139758,3.507843252,Negative,0,0,neutral
113,people with a history of sunburn or overexposure to the sun in childhood have a greater risk of developing basal cell carcinoma,0.16887993,0.13936296,0.16887993,3.629327847,3.73157152,3.529420402,Negative,0,0,support
114,what we do know is that melanoma is highly dependent on how much sun you get and your tendency to get sunburned,0.16888003,0.13936308,0.16888003,2.703879687,3.118261946,3.036629912,Negative,0,0,support
115,"the risk of skin cancer however , may be reduced through awareness of the problem , and by taking measures to prevent exposure to sunlight",0.16887978,0.13936278,0.16887978,2.953397795,3.177056715,2.917554639,Negative,0,0,support
116,"people who do not have much melanin and sun burn easily should protect themselves by covering up sensitive areas , wearing sun block , limiting their total exposure time , and limiting their sun exposure between the hours of 10 a am and too p am",0.1688784,0.1393612,0.1688784,3.399402397,3.249338413,3.175505004,Negative,0,0,neutral
117,researchers say that people should limit their sunbathing time and use clothing to block uva rays when sun is at its strongest,0.1688801,0.13936317,0.1688801,3.05721559,2.959947832,2.916627636,Negative,1,0,neutral
118,people who work outdoors have a greater risk of skin cancer as they are exposed to the sun for long periods of time,0.16887999,0.13936305,0.16887999,3.187060914,3.310741308,3.32675289,Negative,0,0,support
119,"between 2000 and 2009 , melanoma incidence climbed 1 9 percent annually",0.16888005,0.1393631,0.16888005,4.002045148,3.822297089,4.147831626,Negative,0,0,neutral
120,"while healthy cells grow and divide in an orderly way , skin cancer cells grow and divide in a rapid , haphazard manner",0.16887948,0.13936242,0.16887948,3.861615703,3.414656291,3.494111752,Negative,0,0,neutral
